This is hands down the best tofu recipe I've ever had. I don't like the taste of tofu but this recipe makes it so  delicious. Make sure you line your baking sheet with aluminum foil tho because it's gonna be really hard to clean it up afterwards because the sauce that's not on the tofu pieces kinda burns.	this is hands down the best tofu recipe i 've ever had . i do n't like the taste of tofu but this recipe makes it so delicious . make sure you line your baking sheet with aluminum foil tho because it 's g onna be really hard to clean it up afterwards because the sauce that 's not on the tofu pieces kinda burns .	1
My tofu turned out the perfect texture and had a nice glazed coating with a subtle flavor. Maybe a tad too subtle for me so I might amp it up next time. But that's just a personal preference. (followed cook's notes and used brown sugar instead of agave due to what I had on hand.)	my tofu turned out the perfect texture and had a nice glazed coating with a subtle flavor . maybe a tad too subtle for me so i might amp it up next time . but that 's just a personal preference . -lrb- followe d cook 's notes and used brown sugar instead of agave due to what i had on hand . -rrb-	1
This is my go-to recipe for tofu, and my family eats a lot of tofu.  I like the texture and crust that forms with this method, and it is super easy to use in a stir fry dish, add protein to a salad, or just eat with steamed rice and vegetables.  It's very versatile and forgiving; I never measure anything, and improvise if I'm missing an ingredient.  I've made it exactly as written, though, and it is delicious.	this is my go-to recipe for tofu , and my family eats a lot of tofu . i like the texture and crust that forms with this method , and it is super easy to use in a stir fry dish , add protein to a salad , o r just eat with steamed rice and vegetables . it 's very versatile and forgiving ; i never measure anything , and improvise if i 'm missing an ingredient . i 've made it exactly as written , though , and it is delicious .	1
A big hit! I subbed 1 T brown sugar for the agave and omitted the ginger. Super delicious. Served with stir fry veggies and udon noodles. This will become a regular.	a big hit ! i subbed 1 t brown sugar for the agave and omitted the ginger . super delicious . served with stir fry veggies and udon noodles . this will become a regular .	1
Five stars for this dish. I have used honey instead of agave syrup. My husband loved it as well! One of the best tofu recipes we made so far.	five stars for this dish . i have used honey instead of agave syrup . my husband loved it as well ! one of the best tofu recipes we made so far .	1
When I first became vegetarian, I found this recipe for tofu, and it has been a constant in my recipe book ever since! It's super easy to make and has a great flavor. I actually let the tofu marinate in a small pan for a while before baking to give it an even stronger flavor. Sometimes I also broil the tofu for a short amount of time at the very end if I feel like having a crispier tofu.	when i first became vegetarian , i found this recipe for tofu , and it has been a constant in my recipe book ever since ! it 's super easy to make and has a great flavor . i actually let the tofu marinate in a small pan for a while before baking to give it an even stronger flavor . sometimes i also broil the tofu for a short amount of time at the very end if i feel like having a crispier tofu .	1
This is really really good. The sauce gets thick and sticky and just tastes good. I used tamari sauce for the soy so it would be gluten free but otherwise I didn't change a thing...you don't need to. Thank you Teri Rose for your recipe.	this is really really good . the sauce gets thick and sticky and just tastes good . i used tamari sauce for the soy so it would be gluten free but otherwise i did n't change a thing ... you do n't need to . thank you teri rose for your recipe .	1
I mades changes. In my version I used honey olive oil and I didn't add sesame seeds. I made this changes mainly because I didn't have the required ingredients. I also baked them on nonstick foil so they didn't come out crisp. Stick to the original recipe??	i mades changes . in my version i used honey olive oil and i did n't add sesame seeds . i made this changes mainly because i did n't have the required ingredients . i also baked them on nonstick foil so th ey did n't come out crisp . stick to the original recipe ??	1
These were delicious! They were gobbled up within minutes at my potluck supper! I followed the recipe exactly minus the jalapeno I thought it had enough spice from the hot sriracha sauce alone. The tofu chunks stayed perfectly on the skewers. I used organic sprouted super-firm tofu which is usually more durable than a lot of the regular non-sprouted tofu blocks I've bought in grocery stores. (It has a more meaty less-smooth texture) If you use the right tofu it won't fall of the skewer.	these were delicious ! they were gobbled up within minutes at my potluck supper ! i followed the recipe exactly minus the jalapeno i thought it had enough spice from the hot sriracha sauce alone . the to fu chunks stayed perfectly on the skewers . i used organic sprouted super-firm tofu which is usually more durable than a lot of the regular non-sprouted tofu blocks i 've bought in grocery stores . -lrb- it h as a more meaty less-smooth texture -rrb- if you use the right tofu it wo n't fall of the skewer .	1
Wow! This one should convert people to tofu! Very cheap to make and a lot more filling than they look. And gorge all you like - they are really healthy! Use chicken for anyone not too keen on the tofu	wow ! this one should convert people to tofu ! very cheap to make and a lot more filling than they look . and gorge all you like - they are really healthy ! use chicken for anyone not too keen on the tofu	1
The sauce is delicious and can be used with other ingredients. Typically the first time I make a new recipe I follow the directions exactly then I tweek it the next time. With this recipe I left out the jalapeno so that I could have a base from which to determine if/how much jalapeno I'd use the next time. I also had some doubts about the tofu staying on the skewers so I doubled the sauce recipe and marinated shrimp in a separate container. I skewered the shrimp and veggies and used a grilling basket for the tofu and veggies. I also made one skewer with the tofu as per the recipe and the tofu fell off. This meal was an instant hit and the leftover portion served cold over spinach the next night was just a delicious. It's a simple meal to prepare and make.	the sauce is delicious and can be used with other ingredients . typically the first time i make a new recipe i follow the directions exactly then i tweek it the next time . with this recipe i left out t he jalapeno so that i could have a base from which to determine if/how much jalapeno i 'd use the next time . i also had some doubts about the tofu staying on the skewers so i doubled the sauce recipe a nd marinated shrimp in a separate container . i skewered the shrimp and veggies and used a grilling basket for the tofu and veggies . i also made one skewer with the tofu as per the recipe and the tofu fell off . this meal was an instant hit and the leftover portion served cold over spinach the next night was just a delicious . it 's a simple meal to prepare and make .	1
The marinade was delicious but the tofu didn't stay on the skewers. we had to do them separately on tin foil.	the marinade was delicious but the tofu did n't stay on the skewers . we had to do them separately on tin foil .	1
This is the first time I tried cooking with tofu. My husband and I are trying to add more vegetarian meals to our diet. We prepared as per the recipe and we all liked it that includes my son and his girlfriend. Next time we will grill tofu longer since it was our first time we were afraid to overcook the tofu but the smaller more crisper chunks were a better texture. The marinade is excellent!	this is the first time i tried cooking with tofu . my husband and i are trying to add more vegetarian meals to our diet . we prepared as per the recipe and we all liked it that includes my son and his g irlfriend . next time we will grill tofu longer since it was our first time we were afraid to overcook the tofu but the smaller more crisper chunks were a better texture . the marinade is excellent !	1
Oh good Lord- yummy yummy yummy! I had plain Sriracha instead of garlic sriracha so I added a whole bunch of minced garlic. Used onion powder instead of fresh onion. After I tossed the tofu and veggies with the marinade I couldn't stop eating the raw tofu! The marinade is to die for! My carnivore husband went crazy over it too! Healthy and delicious.	oh good lord - yummy yummy yummy ! i had plain sriracha instead of garlic sriracha so i added a whole bunch of minced garlic . used onion powder instead of fresh onion . after i tossed the tofu and veggie s with the marinade i could n't stop eating the raw tofu ! the marinade is to die for ! my carnivore husband went crazy over it too ! healthy and delicious .	1
We love this one. I used Kikkoman Gluten free teriyaki sauce instead of soy sauce to make it less salty. I also added sesame seeds and red pepper flakes in place of the jalapeños. I never seem to have them on hand! Draining freezing and then thawing tofu gives it a meaty texture and will keep it on the skewers so try that. Really good recipe and another great excuse to use Sriracha!	we love this one . i used kikkoman gluten free teriyaki sauce instead of soy sauce to make it less salty . i also added sesame seeds and red pepper flakes in place of the jalapeños . i never seem to have them on hand ! draining freezing and then thawing tofu gives it a meaty texture and will keep it on the skewers so try that . really good recipe and another great excuse to use sriracha !	1
Amazing! I absolutely loved this! I am a huge fan of Sriracha sauce and not only did I marinated the tofu and veggies for a few hours in this delicious mariande but I added more Sriracha on top of mine! The hotter the better. My only changes were to use 1 tblspn of sesame oil and 1 tblspn of olive oil I used orange pepper and baby bella mushrooms with the zucchini....next time I will also add some chunks of vidalia onion to the skewers. Thanks!	amazing ! i absolutely loved this ! i am a huge fan of sriracha sauce and not only did i marinated the tofu and veggies for a few hours in this delicious mariande but i added more sriracha on top of min e! the hotter the better . my only changes were to use 1 tblspn of sesame oil and 1 tblspn of olive oil i used orange pepper and baby bella mushrooms with the zucchini ... next time i will also add some chunks of vidalia onion to the skewers . thanks !	1
I made the scramble part and it was very delicious! I added mushrooms, tomatoes, onion and cilantro and put it on garbanzo beans I had made previously. The hub said it was fantastic! If I had really read the instructions b4 making it I would've cooked the garbanzo beans according to the recipe and it would've been even more tasty. A tip for cooking with tofu is extra firm cut through the middle so you have two flat thin pieces salting and peppering and leaving it cut side down in a colander to strain while u prep everything else. This will cut down on the cook time as well as a lot of the moisture will drain off before you even cook it. This is what I do whenever I want a firmer tofu. You can also put something on top to weigh it down.	i made the scramble part and it was very delicious ! i added mushrooms , tomatoes , onion and cilantro and put it on garbanzo beans i had made previously . the hub said it was fantastic ! if i had really r ead the instructions b4 making it i would 've cooked the garbanzo beans according to the recipe and it would 've been even more tasty . a tip for cooking with tofu is extra firm cut through the middle so you have two flat thin pieces salting and peppering and leaving it cut side down in a colander to strain while u prep everything else . this will cut down on the cook time as well as a lot of the mois ture will drain off before you even cook it . this is what i do whenever i want a firmer tofu . you can also put something on top to weigh it down .	1
I am obsessed with this recipe!  I make a big batch of this on Sunday and pack it in individual containers to have for breakfast all week long.  It is amazing made just as listed, but I have tweaked it to suit my own needs.  I use shredded sweet potato hash browns, instead of the potato, and I omit the tomatoes and add chopped zucchini and mushrooms.  I sometimes add chopped red bell pepper as well. The spices really make this dish. Thanks so much for sharing!	i am obsessed with this recipe ! i make a big batch of this on sunday and pack it in individual containers to have for breakfast all week long . it is amazing made just as listed , but i have tweaked i t to suit my own needs . i use shredded sweet potato hash browns , instead of the potato , and i omit the tomatoes and add chopped zucchini and mushrooms . i sometimes add chopped red bell pepper as wel l . the spices really make this dish . thanks so much for sharing !	1
I am new to being a vegetarian and have been looking for something to replacing my morning eggs. I think I found it! I didn't do the potatoes but I did everything else and it was delicious! I will definitely be making often!	i am new to being a vegetarian and have been looking for something to replacing my morning eggs . i think i found it ! i did n't do the potatoes but i did everything else and it was delicious ! i will def initely be making often !	1
I never like tofu particularly but our daughter is vegan. I've made this several times now for my husband and daughter and me and it is superb. The tofu turmeric looks just like scrambled eggs. The only change I made is to sub in pinto beans for the black beans as a matter of preference. Thank you for such an amazing recipe!	i never like tofu particularly but our daughter is vegan . i 've made this several times now for my husband and daughter and me and it is superb . the tofu turmeric looks just like scrambled eggs . the on ly change i made is to sub in pinto beans for the black beans as a matter of preference . thank you for such an amazing recipe !	1
Tasty. My husband loved it. He thought the eggs were great. He couldn t believe it was tofu and not eggs. I ll make this one again!	tasty . my husband loved it . he thought the eggs were great . he couldn t believe it was tofu and not eggs . i ll make this one again !	1
One cup of onion was too much cut this way down.	one cup of onion was too much cut this way down .	1
First time cooking tofu. It does have the same texture as scrambled eggs. This dish is heavy on protein so try not to eat too much. I didn't have cilantro but most of this just felt like bulky food in a bowl. I'd make it again but definitely recommend the hot sauce. Does need a bit more flavor in there or just heavier seasoning.	first time cooking tofu . it does have the same texture as scrambled eggs . this dish is heavy on protein so try not to eat too much . i did n't have cilantro but most of this just felt like bulky food in a bowl . i 'd make it again but definitely recommend the hot sauce . does need a bit more flavor in there or just heavier seasoning .	1
I have made this recipe twice, the first time with no changes, and it was very good. The second time, I made the following revisions and it was even better:1) DO NOT put tofu in water. 2) Season dry  sliced tofu with salt & pepper. 3) Dredge slices in white flour seasoned with salt & pepper. 3) Dredge tofu in beaten egg seasoned with salt & pepper until completely coated. 4) Dip in seasoned bread crumbs. 5) Cook tofu according to recipe instruction.  6) Spread a small layer of tomato sauce in bottom of lightly oiled baking dish. 7) Place tofu in dish, cover with tomato sauce, sprinkle with cheeses, and bake.   Sprinkle with chopped parsley when you take it out of the oven.	i have made this recipe twice , the first time with no changes , and it was very good . the second time , i made the following revisions and it was even better :1 -rrb- do not put tofu in water . 2 -rrb- season dry sliced tofu with salt & pepper . 3 -rrb- dredge slices in white flour seasoned with salt & pepper . 3 -rrb- dredge tofu in beaten egg seasoned with salt & pepper until completely coated . 4 -rrb- dip in seasoned bread crumbs . 5 -rrb- cook tofu according to recipe instruction . 6 -rrb- spread a small layer of tomato sauce in bottom of lightly oiled baking dish . 7 -rrb- place tofu in dish , cover with tomato sauce , sprinkle with che eses , and bake . sprinkle with chopped parsley when you take it out of the oven .	1
I love this recipe... I'm eating leftovers for lunch right now.  Some very important changes:  After slicing the tofu, press the slices gently between paper towels to drain the water.  Then BAKE IT on a nonstick sheet until it begins to turn golden. You will thank me. Yes, I bake it before frying it... the baking is not instead of frying.  the extra step just makes the texture SO much better... I cook w/ tofu in this way alot. Also, like other reviewers said, I dip the tofu slices in egg before breading and have NO issues w/ the breading coming off while frying.	i love this recipe ... i 'm eating leftovers for lunch right now . some very important changes : after slicing the tofu , press the slices gently between paper towels to drain the water . then bake it on a nonstick sheet until it begins to turn golden . you will thank me . yes , i bake it before frying it ... the baking is not instead of frying . the extra step just makes the texture so much better ... i cook w / tofu in this way alot . also , like other reviewers said , i dip the tofu slices in egg before breading and have no issues w / the breading coming off while frying .	1
This was super easy and quick to make, and very tasty!  To get good bread crumb coating on the tofu without using eggs or oil, I first pressed the tofu into the breadcrumbs, then sprayed each piece all over with cooking spray and then pressed the tofu into the crumb mixture again--this worked well.  I also fried the tofu with cooking spray.  The result was a delicious, non-greasy dish!  I would definitely make this again!	this was super easy and quick to make , and very tasty ! to get good bread crumb coating on the tofu without using eggs or oil , i first pressed the tofu into the breadcrumbs , then sprayed each piece al l over with cooking spray and then pressed the tofu into the crumb mixture again -- this worked well . i also fried the tofu with cooking spray . the result was a delicious , non-greasy dish ! i would de finitely make this again !	1
"This is the BEST tofu recipe I have ever made!!  I have cooked it for guests who said they hated tofu....but after they tasted it, they changed their minds.
This has become my husbands favorite meal!
I made this recipe a little lighter by using cooking spray instead of the oil, and baking it instead of frying it.  It worked out really well! And took away a lot of the fat."	this is the best tofu recipe i have ever made !! i have cooked it for guests who said they hated tofu ... but after they tasted it , they changed their minds . this has become my husbands favorite meal ! i made this recipe a little lighter by using cooking spray instead of the oil , and baking it instead of frying it . it worked out really well ! and took away a lot of the fat .	1
I'm a vegetarian, and I love tofu and use it weekly, but I didn't really care for this. The texture and the flavor were both lacking. I won't be making these again, sorry.	i 'm a vegetarian , and i love tofu and use it weekly , but i did n't really care for this . the texture and the flavor were both lacking . i wo n't be making these again , sorry .	1
I made this sandwich last night for my sister.  I'm vegan- and I also don't use or like mayo. I put a bit more soy sauce on the tofu.  I put Goddess salad dressing on the mayo side and fresh spinach under the tomato slice.  I did use mayo on my sister's sandwich & it came out all yummy & crispy.  I think this is a nice light sandwich that is quite good & very easy to make!	i made this sandwich last night for my sister . i 'm vegan - and i also do n't use or like mayo . i put a bit more soy sauce on the tofu . i put goddess salad dressing on the mayo side and fresh spinach u nder the tomato slice . i did use mayo on my sister 's sandwich & it came out all yummy & crispy . i think this is a nice light sandwich that is quite good & very easy to make !	1
This is really good. I was also my fist time eating tofu. Very tasty. My only problem was the Tahini. I like tahini but on this it is too gritty. I suggest mayonaise on both sides. I also used about a T of shredded mozzerella on my sandwich. YUM!	this is really good . i was also my fist time eating tofu . very tasty . my only problem was the tahini . i like tahini but on this it is too gritty . i suggest mayonaise on both sides . i also used about a t of shredded mozzerella on my sandwich . yum !	1
This was pretty good and the easiness factor is a big benefit! I'll definitely make it again when I'm in a pinch!	this was pretty good and the easiness factor is a big benefit ! i 'll definitely make it again when i 'm in a pinch !	1
I've just become a vegetarian and I was looking for something to eat while the rest of my family is having hamburgers/hot dogs. I thought the sandwich was pretty good. Next time I might try adding some basil and a drop of balsamic vinegar.	i 've just become a vegetarian and i was looking for something to eat while the rest of my family is having hamburgers/hot dogs . i thought the sandwich was pretty good . next time i might try adding som e basil and a drop of balsamic vinegar .	1
An array of flavours makes for a nice sandwich here. The tahini really makes this sandwich. I didn't have pita bread so I used whole grain gluten free sandwich bread. I also drained the tofu and lightly grilled it. The only issue for me was that it only gets toasted on one side under the broiler. Next time I will lightly toast the bread before assembling the sandwich. Do not pass up this sandwich it will not let you down. Thank you Cindy for this nice recipe.	an array of flavours makes for a nice sandwich here . the tahini really makes this sandwich . i did n't have pita bread so i used whole grain gluten free sandwich bread . i also drained the tofu and light ly grilled it . the only issue for me was that it only gets toasted on one side under the broiler . next time i will lightly toast the bread before assembling the sandwich . do not pass up this sandwich it will not let you down . thank you cindy for this nice recipe .	1
I'm not much of a fan of tahini but the tofu and tomatoes help to balance it out. Given Crazy Z's suggestion for more soy sauce and CARRIEZ's for adding mozzarella this is an excellent treat.	i 'm not much of a fan of tahini but the tofu and tomatoes help to balance it out . given crazy z 's suggestion for more soy sauce and carriez 's for adding mozzarella this is an excellent treat .	1
Pretty good! Quick & filling. I will make again but add additional veggies (lettuce peppers onion) after it's broiled to add a little texture. I made on whole wheat because I didn't have pita bread and it was a smidge soggy. I think bread should be toasted first if you sub.	pretty good ! quick & filling . i will make again but add additional veggies -lrb- lettuce peppers onion -rrb- after it 's broiled to add a little texture . i made on whole wheat because i did n't have pita bread an d it was a smidge soggy . i think bread should be toasted first if you sub .	1
Loved this. Tried this when I had leftover tofu from another recipe. Was tricky getting the tahini on pita without dripping everywhere (I stirred and stirred and stirred). Will definitely make it again.	loved this . tried this when i had leftover tofu from another recipe . was tricky getting the tahini on pita without dripping everywhere -lrb- i stirred and stirred and stirred -rrb- . will definitely make it agai n.	1
Great flavor will make again BUT I will not pour sauce over the tofu it gets soggy. It would be better to dip as I go.	great flavor will make again but i will not pour sauce over the tofu it gets soggy . it would be better to dip as i go .	1
I made this for Thanksgiving and although it was a lot of work it tasted soooo good! I definitely recommend starting early crumbling the tofu AND pulsing it in the food processor until really smooth then draining it. Works much much better! My whole family tried it and couldn't believe how good it was. Yes! This is a thanksgiving staple!	i made this for thanksgiving and although it was a lot of work it tasted soooo good ! i definitely recommend starting early crumbling the tofu and pulsing it in the food processor until really smooth t hen draining it . works much much better ! my whole family tried it and could n't believe how good it was . yes ! this is a thanksgiving staple !	1
