Located in Singapore, Resorts World Sentosa - Festive Hotel is near the beach. Singapore Cruise Centre and Marina Bay Cruise Centre Singapore are worth checking out if an activity is on the agenda, while those in the mood for shopping can visit Raffles Place and Bugis Street Shopping District. Looking to enjoy an event or a game? See what&#39;s going on at Singapore National Stadium or Singapore Indoor Stadium. Our guests appreciate the hotel&#39;s location for the sightseeing. 	located in singapore , resorts world sentosa - festive hotel is near the beach . singapore cruise centre and marina bay cruise centre singapore are worth checking out if an activity is on the agenda , wh ile those in the mood for shopping can visit raffles place and bugis street shopping district . looking to enjoy an event or a game ? see what &#39; s going on at singapore national stadium or singapore i ndoor stadium . our guests appreciate the hotel &#39; s location for the sightseeing .	1
Located in Singapore, Resorts World Sentosa - Hard Rock Hotel is near the beach. Singapore Cruise Centre and Marina Bay Cruise Centre Singapore are worth checking out if an activity is on the agenda, while those in the mood for shopping can visit Raffles Place and Festive Walk. S.E.A. Aquarium and Universal Studios Singapore™ are not to be missed. 	located in singapore , resorts world sentosa - hard rock hotel is near the beach . singapore cruise centre and marina bay cruise centre singapore are worth checking out if an activity is on the agenda , while those in the mood for shopping can visit raffles place and festive walk . s.e.a. aquarium and universal studios singapore ™ are not to be missed .	1
Located in Singapore, Resorts World Sentosa - Hotel Michael is near the beach. Singapore Cruise Centre and Marina Bay Cruise Centre Singapore are worth checking out if an activity is on the agenda, while those wishing to experience the area&#39;s natural beauty can explore Siloso Beach and Palawan Beach. Check out an event or a game at Singapore National Stadium, and consider making time for S.E.A. Aquarium, a top attraction not to be missed. 	located in singapore , resorts world sentosa - hotel michael is near the beach . singapore cruise centre and marina bay cruise centre singapore are worth checking out if an activity is on the agenda , wh ile those wishing to experience the area &#39; s natural beauty can explore siloso beach and palawan beach . check out an event or a game at singapore national stadium , and consider making time for s.e.a . aquarium , a top attraction not to be missed .	1
Located in Hulhumalé, Royal Relax Holiday is in the city center and on the beach. Maldives Islamic Centre is a notable landmark, and the area&#39;s natural beauty can be seen at Hulhumale Beach and Kurumba Beach. Discover the area&#39;s water adventures with scuba diving, snorkeling, and surfing/boogie boarding nearby, or enjoy the great outdoors with hiking/biking trails. 	located in hulhumalé , royal relax holiday is in the city center and on the beach . maldives islamic centre is a notable landmark , and the area &#39; s natural beauty can be seen at hulhumale beach and ku rumba beach . discover the area &#39; s water adventures with scuba diving , snorkeling , and surfing/boogie boarding nearby , or enjoy the great outdoors with hiking/biking trails .	1
Located in Nassau, Ocean West Boutique Hotel is near the airport and near the beach. Paradise Island Golf Club and Ocean Club Golf Course are worth checking out if an activity is on the agenda, while those wishing to experience the area&#39;s natural beauty can explore Cable Beach and Cabbage Beach. Ardastra Gardens, Zoo and Conservation Center and Stingray City are also worth visiting. Our guests appreciate the hotel&#39;s quiet location. 	located in nassau , ocean west boutique hotel is near the airport and near the beach . paradise island golf club and ocean club golf course are worth checking out if an activity is on the agenda , while those wishing to experience the area &#39; s natural beauty can explore cable beach and cabbage beach . ardastra gardens , zoo and conservation center and stingray city are also worth visiting . our guests appreciate the hotel &#39; s quiet location .	1
Located in Cockburn Harbour, East Bay Resort - All Beachfront Suites - Island hop required is near the airport and on the beach. Highland House is a notable landmark, and the area&#39;s natural beauty can be seen at Long Cay Beach and The Boiling Hole. Looking to get your feet wet? Scuba diving and snorkeling adventures can be found near the property. 	located in cockburn harbour , east bay resort - all beachfront suites - island hop required is near the airport and on the beach . highland house is a notable landmark , and the area &#39; s natural beauty can be seen at long cay beach and the boiling hole . looking to get your feet wet ? scuba diving and snorkeling adventures can be found near the property .	1
Somerset Inn is located near the beach and in an area with good airport proximity. Maldives Islamic Centre and Republic Square are notable landmarks, and travelers looking to shop may want to visit Male Fish Market. Looking to get your feet wet? Scuba diving, snorkeling and boat tours adventures can be found near the property. 	somerset inn is located near the beach and in an area with good airport proximity . maldives islamic centre and republic square are notable landmarks , and travelers looking to shop may want to visit ma le fish market . looking to get your feet wet ? scuba diving , snorkeling and boat tours adventures can be found near the property .	1
"Located in Savaneta, Coral Reef Beach Aruba is in the historical district and on a private beach. While the natural beauty of Mangel Halto Beach and Eagle Beach can be enjoyed by anyone, those looking for an activity can check out Links at Divi Aruba. 
Blue Parrotfish Water Park and Donkey Sanctuary Aruba are also worth visiting. "	located in savaneta , coral reef beach aruba is in the historical district and on a private beach . while the natural beauty of mangel halto beach and eagle beach can be enjoyed by anyone , those looking for an activity can check out links at divi aruba . blue parrotfish water park and donkey sanctuary aruba are also worth visiting .	1
Located in La Fortuna, Hotel Los Lagos Spa &amp; Resort is in a rural area. Mistico Arenal Hanging Bridges Park is a popular attraction and the area&#39;s natural beauty can be seen at Arenal Volcano and La Fortuna Waterfall. Traveling with kids? Consider Kalambu Hot Springs and Arenal Natura Ecological Park. 	located in la fortuna , hotel los lagos spa & resort is in a rural area . mistico arenal hanging bridges park is a popular attraction and the area &#39; s natural beauty can be seen at arenal volcano and la fortuna waterfall . traveling with kids ? consider kalambu hot springs and arenal natura ecological park .	1
Located in Maafushi, Arena Beach Hotel is on a private beach. Local points of interest include Maafushi Reef, Maafushi Mosque, and Maafushi Harbor. 	located in maafushi , arena beach hotel is on a private beach . local points of interest include maafushi reef , maafushi mosque , and maafushi harbor .	1
Located in Santo Domingo, Catalonia Santo Domingo is connected to a shopping center. Eduardo Brito National Theater and Colon Lighthouse and Museum are cultural highlights, and some of the area&#39;s notable landmarks include National Palace and Cathedral of Santo Domingo. Looking to enjoy an event or a game while in town? See what&#39;s going on at Centro Olimpico. 	located in santo domingo , catalonia santo domingo is connected to a shopping center . eduardo brito national theater and colon lighthouse and museum are cultural highlights , and some of the area &#39; s notable landmarks include national palace and cathedral of santo domingo . looking to enjoy an event or a game while in town ? see what &#39; s going on at centro olimpico .	1
Located in Cockburn Town, Bohio Dive Resort is near the airport and on the beach. Turks &amp; Caicos National Museum and Grand Turk Lighthouse are local landmarks, and the area&#39;s natural beauty can be seen at Cruise Center Beach and Columbus Landfall National Park Beach. 	located in cockburn town , bohio dive resort is near the airport and on the beach . turks & caicos national museum and grand turk lighthouse are local landmarks , and the area &#39; s natural beauty ca n be seen at cruise center beach and columbus landfall national park beach .	1
Located in Santo Domingo, Intercontinental Real Santo Domingo is in the business district. National Museum and Colon Lighthouse and Museum are cultural highlights, and some of the area&#39;s notable landmarks include National Palace and Alcazar de Colon. Looking to enjoy an event or a game? See what&#39;s going on at Centro Olimpico or Quisqueya Stadium. Our guests appreciate the hotel&#39;s location for the nightlife. 	located in santo domingo , intercontinental real santo domingo is in the business district . national museum and colon lighthouse and museum are cultural highlights , and some of the area &#39; s notable l andmarks include national palace and alcazar de colon . looking to enjoy an event or a game ? see what &#39; s going on at centro olimpico or quisqueya stadium . our guests appreciate the hotel &#39; s locat ion for the nightlife .	1
"Located in Tamarindo, Hotel In the Shade - Adults Only  is in the city center and near the beach. While the natural beauty of Tamarindo Beach and Playa Brasilito can be enjoyed by anyone, those looking for an activity can check out Hacienda Pinilla Golf Course. 
Tamarindo Church and Canopy Vista Tamarindo are also worth visiting. Take an opportunity to explore the area for water adventures such as scuba diving. "	located in tamarindo , hotel in the shade - adults only is in the city center and near the beach . while the natural beauty of tamarindo beach and playa brasilito can be enjoyed by anyone , those lookin g for an activity can check out hacienda pinilla golf course . tamarindo church and canopy vista tamarindo are also worth visiting . take an opportunity to explore the area for water adventures such as scuba diving .	1
Located in Cockburn Town, Turks Head Inne is on the Strip and near the beach. Turks &amp; Caicos National Museum and Grand Turk Lighthouse are local landmarks, and the area&#39;s natural beauty can be seen at Cruise Center Beach and Columbus Landfall National Park Beach. Discover the area&#39;s water adventures with kayaking and scuba diving nearby, or enjoy the great outdoors with ziplining and hiking/biking trails. 	located in cockburn town , turks head inne is on the strip and near the beach . turks & caicos national museum and grand turk lighthouse are local landmarks , and the area &#39; s natural beauty can be seen at cruise center beach and columbus landfall national park beach . discover the area &#39; s water adventures with kayaking and scuba diving nearby , or enjoy the great outdoors with ziplining and h iking/biking trails .	1
Located in Sliema, Palazzo Violetta is in the city center and near the beach. Sliema Promenade and St. Paul&#39;s Cathedral are notable landmarks, and the area&#39;s natural beauty can be seen at St George&#39;s Beach and Upper Barrakka Gardens. Malta National Aquarium and Palazzo Parisio &amp; Gardens are also worth visiting. Spend some time exploring the area&#39;s activities, including segway rentals/tours. 	located in sliema , palazzo violetta is in the city center and near the beach . sliema promenade and st. paul &#39; s cathedral are notable landmarks , and the area &#39; s natural beauty can be seen at st g eorge &#39; s beach and upper barrakka gardens . malta national aquarium and palazzo parisio & gardens are also worth visiting . spend some time exploring the area &#39; s activities , including segway r entals/tours .	1
Located in Valletta, La Falconeria Hotel is in the city center and near the airport. National Museum of Fine Arts and Royal Opera House are cultural highlights, or if an activity is on the agenda, check out Sliema Ferry. Malta National Aquarium and San Anton Gardens are also worth visiting. 	located in valletta , la falconeria hotel is in the city center and near the airport . national museum of fine arts and royal opera house are cultural highlights , or if an activity is on the agenda , che ck out sliema ferry . malta national aquarium and san anton gardens are also worth visiting .	1
Located in Smith&#39;s, The Loren at Pink Beach is in the historical district and on a private beach. The area&#39;s natural beauty can be seen at Elbow Beach and Horseshoe Bay. Traveling with kids? Consider Devil&#39;s Hole Aquarium and Bermuda Aquarium Museum and Zoo (BAMZ). Discover the area&#39;s water adventures with kayaking and scuba diving nearby, or enjoy the great outdoors with ecotours and cave exploring. 	located in smith &#39; s , the loren at pink beach is in the historical district and on a private beach . the area &#39; s natural beauty can be seen at elbow beach and horseshoe bay . traveling with kids ? c onsider devil &#39; s hole aquarium and bermuda aquarium museum and zoo -lrb- bamz -rrb- . discover the area &#39; s water adventures with kayaking and scuba diving nearby , or enjoy the great outdoors with ecotours and cave exploring .	1
Located in Maafushi, Kaani Grand Seaview is in a rural area and on the beach. Local points of interest include Maafushi Reef, Maafushi Mosque, and Maafushi Harbor. 	located in maafushi , kaani grand seaview is in a rural area and on the beach . local points of interest include maafushi reef , maafushi mosque , and maafushi harbor .	1
"Located in Tamarindo, Hotel La Palapa is on the beach. While the natural beauty of Tamarindo Beach and Grande Beach can be enjoyed by anyone, those looking for an activity can check out Hacienda Pinilla Golf Course. 
Don&#39;t miss out on a visit to Monkey Park. "	located in tamarindo , hotel la palapa is on the beach . while the natural beauty of tamarindo beach and grande beach can be enjoyed by anyone , those looking for an activity can check out hacienda pinil la golf course . don &#39; t miss out on a visit to monkey park .	1
"Located in Boca Chica, Hampton by Hilton Santo Domingo Airport is in an area with great airport proximity. While the natural beauty of Boca Chica and La Caleta Park can be enjoyed by anyone, those looking for an activity can check out Caucedo Port. 
Nautical Club of Santo Domingo and Agua Splash Caribe Aquatic Park are also worth visiting. "	located in boca chica , hampton by hilton santo domingo airport is in an area with great airport proximity . while the natural beauty of boca chica and la caleta park can be enjoyed by anyone , those loo king for an activity can check out caucedo port . nautical club of santo domingo and agua splash caribe aquatic park are also worth visiting .	1
Palazzo Paolina Boutique Hotel is located in Valletta. Sliema Promenade and St. Paul&#39;s Cathedral are notable landmarks, and some of the area&#39;s activities can be experienced at Grand Harbour and Sliema Ferry. Malta National Aquarium and San Anton Gardens are also worth visiting. Our guests love the hotel&#39;s central location. 	palazzo paolina boutique hotel is located in valletta . sliema promenade and st. paul &#39; s cathedral are notable landmarks , and some of the area &#39; s activities can be experienced at grand harbour an d sliema ferry . malta national aquarium and san anton gardens are also worth visiting . our guests love the hotel &#39; s central location .	1
Located in Gros Islet, Harbor Club St. Lucia, Curio Collection by Hilton is in the entertainment district and near the beach. Rodney Bay Marina and Sandals Golf and Country Club are worth checking out if an activity is on the agenda, while those wishing to experience the area&#39;s natural beauty can explore Reduit Beach and Pigeon Island National Park. Looking to enjoy an event or a game while in town? See what&#39;s going on at Daren Sammy Cricket Ground. Discover the area&#39;s water adventures with kayaking and snorkeling nearby, or enjoy the great outdoors with ziplining and hiking/biking trails. 	located in gros islet , harbor club st. lucia , curio collection by hilton is in the entertainment district and near the beach . rodney bay marina and sandals golf and country club are worth checking out if an activity is on the agenda , while those wishing to experience the area &#39; s natural beauty can explore reduit beach and pigeon island national park . looking to enjoy an event or a game while in town ? see what &#39; s going on at daren sammy cricket ground . discover the area &#39; s water adventures with kayaking and snorkeling nearby , or enjoy the great outdoors with ziplining and hiking/biking trails .	1
Located in Escazu, AC Hotel San Jose Escazu is near the airport. Museum of Costa Rican Art and National Theater are cultural highlights, and travelers looking to shop may want to visit Multiplaza Mall Escazu. Check out an event or a game at Costa Rica National Stadium (Estadio Nacional de Costa Rica), and consider making time for Spirogyra Butterfly Garden, a top attraction not to be missed. 	located in escazu , ac hotel san jose escazu is near the airport . museum of costa rican art and national theater are cultural highlights , and travelers looking to shop may want to visit multiplaza mall escazu . check out an event or a game at costa rica national stadium -lrb- estadio nacional de costa rica -rrb- , and consider making time for spirogyra butterfly garden , a top attraction not to be missed .	1
Located in Sliema, Mr. Todd Hotel is in the city center. Malta Experience and Fort St. Elmo are cultural highlights, and some of the area&#39;s activities can be experienced at Grand Harbour and Sliema Ferry. Malta National Aquarium and Palazzo Parisio &amp; Gardens are also worth visiting. 	located in sliema , mr. todd hotel is in the city center . malta experience and fort st. elmo are cultural highlights , and some of the area &#39; s activities can be experienced at grand harbour and sliem a ferry . malta national aquarium and palazzo parisio & gardens are also worth visiting .	1
S Hotel Jamaica is located on the beach and in an area with great airport proximity. Montego Bay Cruise Ship Terminal and Tryall Golf Club are worth checking out if an activity is on the agenda, while those looking for area attractions can visit AquaSol Theme Park and Rocklands Bird Sanctuary. 	s hotel jamaica is located on the beach and in an area with great airport proximity . montego bay cruise ship terminal and tryall golf club are worth checking out if an activity is on the agenda , while those looking for area attractions can visit aquasol theme park and rocklands bird sanctuary .	1
Located in George Town, Island Time Villas is in the city center and on the beach. Rolletown Tombs and Hermitage Tomb are local landmarks, and the area&#39;s natural beauty can be seen at Emerald Bay Beach and Tropic of Cancer Beach. 	located in george town , island time villas is in the city center and on the beach . rolletown tombs and hermitage tomb are local landmarks , and the area &#39; s natural beauty can be seen at emerald bay beach and tropic of cancer beach .	1
Located in Malé, Mookai Hotel is near the beach. Maldives Islamic Centre is a notable landmark, and the area&#39;s natural beauty can be seen at Kurumba Beach and Hulhumale Beach. 	located in malé , mookai hotel is near the beach . maldives islamic centre is a notable landmark , and the area &#39; s natural beauty can be seen at kurumba beach and hulhumale beach .	1
Villa Caribbean Dream is located in Vieux Fort. Moule a Chique Lighthouse and Fond Doux Estate are local landmarks, and the area&#39;s natural beauty can be seen at Gros Piton and Windward Islands. 	villa caribbean dream is located in vieux fort . moule a chique lighthouse and fond doux estate are local landmarks , and the area &#39; s natural beauty can be seen at gros piton and windward islands .	1
Located in Hulhumalé, Meri Maldives is near the beach. Maldives Islamic Centre is a notable landmark, and the area&#39;s natural beauty can be seen at Hulhumale Beach and Kurumba Beach. 	located in hulhumalé , meri maldives is near the beach . maldives islamic centre is a notable landmark , and the area &#39; s natural beauty can be seen at hulhumale beach and kurumba beach .	1
Located in Runaway Bay, Tamarind Tree Resort is near the beach. Our Lady of Perpetual Help Roman Catholic Church is a local landmark, and the area&#39;s natural beauty can be seen at Green Grotto Caves and Flavours Beach. 	located in runaway bay , tamarind tree resort is near the beach . our lady of perpetual help roman catholic church is a local landmark , and the area &#39; s natural beauty can be seen at green grotto cave s and flavours beach .	1
Crystal Sands Villa is located in Maafushi. Local points of interest include Maafushi Reef, Maafushi Mosque, and Maafushi Harbor. 	crystal sands villa is located in maafushi . local points of interest include maafushi reef , maafushi mosque , and maafushi harbor .	1
Located in Maafushi, Kaani Palm Beach is on a private beach. Local points of interest include Maafushi Reef, Maafushi Mosque, and Maafushi Harbor. 	located in maafushi , kaani palm beach is on a private beach . local points of interest include maafushi reef , maafushi mosque , and maafushi harbor .	1
Athens View Guraidhoo is located in Guraidhoo. Local points of interest include Kandooma Beach and Biyadoo Beach. 	athens view guraidhoo is located in guraidhoo . local points of interest include kandooma beach and biyadoo beach .	1
Located in Singapore, Swissotel The Stamford, Singapore is connected to a shopping center. Merlion and Marina Bay Sands Skypark are notable landmarks, and travelers looking to shop may want to visit Raffles City and Bugis Street Shopping District. Looking to enjoy an event or a game? See what&#39;s going on at Singapore National Stadium or Singapore Indoor Stadium. 	located in singapore , swissotel the stamford , singapore is connected to a shopping center . merlion and marina bay sands skypark are notable landmarks , and travelers looking to shop may want to visit r affles city and bugis street shopping district . looking to enjoy an event or a game ? see what &#39; s going on at singapore national stadium or singapore indoor stadium .	1
Located in Singapore, Peninsula Excelsior Hotel is connected to a shopping center. National Gallery Singapore and National Museum of Singapore are cultural highlights, and some of the area&#39;s notable landmarks include Merlion and Marina Bay Sands Skypark. Looking to enjoy an event or a game? See what&#39;s going on at Singapore National Stadium or Singapore Indoor Stadium. Our guests appreciate the hotel&#39;s location for the sightseeing. 	located in singapore , peninsula excelsior hotel is connected to a shopping center . national gallery singapore and national museum of singapore are cultural highlights , and some of the area &#39; s notab le landmarks include merlion and marina bay sands skypark . looking to enjoy an event or a game ? see what &#39; s going on at singapore national stadium or singapore indoor stadium . our guests appreciate the hotel &#39; s location for the sightseeing .	1
"Harmony Suites is located near the beach and in a walkable area with good shopping. While the natural beauty of Reduit Beach and Vigie Beach can be enjoyed by anyone, those looking for an activity can check out Rodney Bay Marina. 
Looking to enjoy an event or a game while in town? See what&#39;s going on at Daren Sammy Cricket Ground, or consider a night out at Friday Night Street Party. Looking to get your feet wet? Kayaking, scuba diving and snorkeling adventures can be found near the property. "	harmony suites is located near the beach and in a walkable area with good shopping . while the natural beauty of reduit beach and vigie beach can be enjoyed by anyone , those looking for an activity can check out rodney bay marina . looking to enjoy an event or a game while in town ? see what &#39; s going on at daren sammy cricket ground , or consider a night out at friday night street party . looking t o get your feet wet ? kayaking , scuba diving and snorkeling adventures can be found near the property .	1
In the city center and near a metro station, Carlton Hotel Singapore is in an area with great airport proximity. Mint Museum of Toys and Singapore Art Museum are cultural highlights, and some of the area&#39;s notable landmarks include Stamford House and Cathedral of the Good Shepherd. Singapore Flyer and Universal Studios Singapore™ are not to be missed. Spend some time exploring the area&#39;s activities, including golfing. 	in the city center and near a metro station , carlton hotel singapore is in an area with great airport proximity . mint museum of toys and singapore art museum are cultural highlights , and some of the a rea &#39; s notable landmarks include stamford house and cathedral of the good shepherd . singapore flyer and universal studios singapore ™ are not to be missed . spend some time exploring the area &#39; s a ctivities , including golfing .	1
