Located in Singapore, Swissotel The Stamford, Singapore is connected to a shopping center. Merlion and Marina Bay Sands Skypark are notable landmarks, and travelers looking to shop may want to visit Raffles City and Bugis Street Shopping District. Looking to enjoy an event or a game? See what&#39;s going on at Singapore National Stadium or Singapore Indoor Stadium. 	located in singapore , swissotel the stamford , singapore is connected to a shopping center . merlion and marina bay sands skypark are notable landmarks , and travelers looking to shop may want to visit r affles city and bugis street shopping district . looking to enjoy an event or a game ? see what &#39; s going on at singapore national stadium or singapore indoor stadium .	1
Located in Singapore, Peninsula Excelsior Hotel is connected to a shopping center. National Gallery Singapore and National Museum of Singapore are cultural highlights, and some of the area&#39;s notable landmarks include Merlion and Marina Bay Sands Skypark. Looking to enjoy an event or a game? See what&#39;s going on at Singapore National Stadium or Singapore Indoor Stadium. Our guests appreciate the hotel&#39;s location for the sightseeing. 	located in singapore , peninsula excelsior hotel is connected to a shopping center . national gallery singapore and national museum of singapore are cultural highlights , and some of the area &#39; s notab le landmarks include merlion and marina bay sands skypark . looking to enjoy an event or a game ? see what &#39; s going on at singapore national stadium or singapore indoor stadium . our guests appreciate the hotel &#39; s location for the sightseeing .	1
"Harmony Suites is located near the beach and in a walkable area with good shopping. While the natural beauty of Reduit Beach and Vigie Beach can be enjoyed by anyone, those looking for an activity can check out Rodney Bay Marina. 
Looking to enjoy an event or a game while in town? See what&#39;s going on at Daren Sammy Cricket Ground, or consider a night out at Friday Night Street Party. Looking to get your feet wet? Kayaking, scuba diving and snorkeling adventures can be found near the property. "	harmony suites is located near the beach and in a walkable area with good shopping . while the natural beauty of reduit beach and vigie beach can be enjoyed by anyone , those looking for an activity can check out rodney bay marina . looking to enjoy an event or a game while in town ? see what &#39; s going on at daren sammy cricket ground , or consider a night out at friday night street party . looking t o get your feet wet ? kayaking , scuba diving and snorkeling adventures can be found near the property .	1
In the city center and near a metro station, Carlton Hotel Singapore is in an area with great airport proximity. Mint Museum of Toys and Singapore Art Museum are cultural highlights, and some of the area&#39;s notable landmarks include Stamford House and Cathedral of the Good Shepherd. Singapore Flyer and Universal Studios Singapore™ are not to be missed. Spend some time exploring the area&#39;s activities, including golfing. 	in the city center and near a metro station , carlton hotel singapore is in an area with great airport proximity . mint museum of toys and singapore art museum are cultural highlights , and some of the a rea &#39; s notable landmarks include stamford house and cathedral of the good shepherd . singapore flyer and universal studios singapore ™ are not to be missed . spend some time exploring the area &#39; s a ctivities , including golfing .	1
Located in Marina Bay neighborhood, The Ritz-Carlton, Millenia Singapore is connected to a shopping center. Esplanade Theatres and ArtScience Museum are cultural highlights, and travelers looking to shop may want to visit Millenia Walk and Marina Square. Traveling with kids? Don&#39;t miss Singapore Flyer. Break out the clubs and hit the links with a golf course nearby, or seek out an adventure with hiking/biking trails. 	located in marina bay neighborhood , the ritz-carlton , millenia singapore is connected to a shopping center . esplanade theatres and artscience museum are cultural highlights , and travelers looking to s hop may want to visit millenia walk and marina square . traveling with kids ? don &#39; t miss singapore flyer . break out the clubs and hit the links with a golf course nearby , or seek out an adventure wi th hiking/biking trails .	1
Located in Marina Bay neighborhood, Pan Pacific Singapore is connected to a shopping center. Marina Bay Cruise Centre Singapore and Boat Quay are worth checking out if an activity is on the agenda, while those in the mood for shopping can visit Marina Square and Bugis Street Shopping District. Traveling with kids? Don&#39;t miss Singapore Flyer and National Orchid Garden. Spend some time exploring the area&#39;s activities, including golfing. Our guests appreciate the hotel&#39;s central location. 	located in marina bay neighborhood , pan pacific singapore is connected to a shopping center . marina bay cruise centre singapore and boat quay are worth checking out if an activity is on the agenda , wh ile those in the mood for shopping can visit marina square and bugis street shopping district . traveling with kids ? don &#39; t miss singapore flyer and national orchid garden . spend some time exploring the area &#39; s activities , including golfing . our guests appreciate the hotel &#39; s central location .	1
Located in San Jose, Radisson San Jose-Costa Rica is connected to the convention center. Children&#39;s Museum (Museo de los Ninos) and National Theater are cultural highlights, and travelers looking to shop may want to visit Mercado Central. Traveling with kids? Don&#39;t miss Simon Bolivar Zoo. Practice your golf swing with lessons and a golf course nearby, or enjoy other activities in the great outdoors, such as hiking/biking trails and ecotours in the area. Our guests appreciate the hotel&#39;s central location. 	located in san jose , radisson san jose-costa rica is connected to the convention center . children &#39; s museum -lrb- museo de los ninos -rrb- and national theater are cultural highlights , and travelers looking to shop may want to visit mercado central . traveling with kids ? don &#39; t miss simon bolivar zoo . practice your golf swing with lessons and a golf course nearby , or enjoy other activities in the great outdoors , such as hiking/biking trails and ecotours in the area . our guests appreciate the hotel &#39; s central location .	1
Located in George Town, Augusta Bay is in the entertainment district and on a private beach. Rolletown Tombs and Hermitage Tomb are local landmarks, and the area&#39;s natural beauty can be seen at Emerald Bay Beach and Tropic of Cancer Beach. Discover the area&#39;s water adventures with scuba diving, snorkeling, and sailing nearby, or enjoy the great outdoors with ecotours. 	located in george town , augusta bay is in the entertainment district and on a private beach . rolletown tombs and hermitage tomb are local landmarks , and the area &#39; s natural beauty can be seen at em erald bay beach and tropic of cancer beach . discover the area &#39; s water adventures with scuba diving , snorkeling , and sailing nearby , or enjoy the great outdoors with ecotours .	1
Located in St. Julian&#39;s, Golden Tulip Vivaldi Hotel is in the entertainment district and near the beach. Malta Experience and Fort St. Elmo are cultural highlights, and some of the area&#39;s notable landmarks include Sliema Promenade and St. Paul&#39;s Cathedral. Malta National Aquarium and Mediterraneo Marine Park are also worth visiting. Scuba diving, water skiing, and windsurfing offer great chances to get out on the surrounding water, or you can seek out an adventure with ecotours nearby. 	located in st. julian &#39; s , golden tulip vivaldi hotel is in the entertainment district and near the beach . malta experience and fort st. elmo are cultural highlights , and some of the area &#39; s nota ble landmarks include sliema promenade and st. paul &#39; s cathedral . malta national aquarium and mediterraneo marine park are also worth visiting . scuba diving , water skiing , and windsurfing offer gre at chances to get out on the surrounding water , or you can seek out an adventure with ecotours nearby .	1
Located in St. Julian&#39;s, The Westin Dragonara Resort, Malta is in the city center and by the sea. Sliema Promenade and St. Paul&#39;s Cathedral are notable landmarks, and the area&#39;s natural beauty can be seen at St George&#39;s Beach and Upper Barrakka Gardens. Traveling with kids? Consider Malta National Aquarium and Mediterraneo Marine Park. 	located in st. julian &#39; s , the westin dragonara resort , malta is in the city center and by the sea . sliema promenade and st. paul &#39; s cathedral are notable landmarks , and the area &#39; s natural be auty can be seen at st george &#39; s beach and upper barrakka gardens . traveling with kids ? consider malta national aquarium and mediterraneo marine park .	1
British Colonial Hilton - Nassau is located on a private beach and in a walkable area with good shopping. Paradise Island Golf Club and Ocean Club Golf Course are worth checking out if an activity is on the agenda, while those wishing to experience the area&#39;s natural beauty can explore Cabbage Beach and Junkanoo Beach. Traveling with kids? Consider Ardastra Gardens, Zoo and Conservation Center and Stingray City. Discover the area&#39;s water adventures with water skiing, parasailing, and windsurfing nearby, or enjoy the great outdoors with ecotours. Our guests appreciate the hotel&#39;s central location. 	british colonial hilton - nassau is located on a private beach and in a walkable area with good shopping . paradise island golf club and ocean club golf course are worth checking out if an activity is on the agenda , while those wishing to experience the area &#39; s natural beauty can explore cabbage beach and junkanoo beach . traveling with kids ? consider ardastra gardens , zoo and conservation center and stingray city . discover the area &#39; s water adventures with water skiing , parasailing , and windsurfing nearby , or enjoy the great outdoors with ecotours . our guests appreciate the hotel &#39; s ce ntral location .	1
Located in St. Julian&#39;s, Hilton Malta is connected to a shopping center. The area&#39;s natural beauty can be seen at St George&#39;s Beach and Upper Barrakka Gardens, while Malta Experience and Fort St. Elmo are cultural highlights. Traveling with kids? Consider Malta National Aquarium and Mediterraneo Marine Park. With scuba diving, snorkeling, and water skiing nearby, you&#39;ll find plenty of adventures in the water. 	located in st. julian &#39; s , hilton malta is connected to a shopping center . the area &#39; s natural beauty can be seen at st george &#39; s beach and upper barrakka gardens , while malta experience and f ort st. elmo are cultural highlights . traveling with kids ? consider malta national aquarium and mediterraneo marine park . with scuba diving , snorkeling , and water skiing nearby , you &#39; ll find plenty of adventures in the water .	1
Located in St. Paul&#39;s Bay, Il Palazzin Hotel is in the city center and near the beach. Kennedy Grove and St. Johns Co - Cathedral are notable landmarks, and the area&#39;s natural beauty can be seen at Golden Sands Beach and Mellieha Bay. Don&#39;t miss out on a visit to Malta National Aquarium. With jet skiing, scuba diving, and snorkeling nearby, you&#39;ll find plenty of adventures in the water. 	located in st. paul &#39; s bay , il palazzin hotel is in the city center and near the beach . kennedy grove and st. johns co - cathedral are notable landmarks , and the area &#39; s natural beauty can be se en at golden sands beach and mellieha bay . don &#39; t miss out on a visit to malta national aquarium . with jet skiing , scuba diving , and snorkeling nearby , you &#39; ll find plenty of adventures in the w ater .	1
Located in Sosua,  Casa Marina Beach and Reef is in a rural area and on the beach. The area&#39;s natural beauty can be seen at Sosua Beach and Cabarete Beach. Laguna SOV and Fun City are also worth visiting. With snorkeling, water skiing, and parasailing nearby, you&#39;ll find plenty of adventures in the water. 	located in sosua , casa marina beach and reef is in a rural area and on the beach . the area &#39; s natural beauty can be seen at sosua beach and cabarete beach . laguna sov and fun city are also worth v isiting . with snorkeling , water skiing , and parasailing nearby , you &#39; ll find plenty of adventures in the water .	1
Located in Sliema, AX │ The Victoria Hotel is in the city center and near the beach. Sliema Promenade and St. Paul&#39;s Cathedral are notable landmarks, and the area&#39;s natural beauty can be seen at Upper Barrakka Gardens and St George&#39;s Beach. Malta National Aquarium and Palazzo Parisio &amp; Gardens are also worth visiting. Scuba diving, snorkeling, and water skiing offer great chances to get out on the surrounding water, or you can seek out an adventure with mountain biking nearby. Our guests appreciate the hotel&#39;s quiet location. 	located in sliema , ax │ the victoria hotel is in the city center and near the beach . sliema promenade and st. paul &#39; s cathedral are notable landmarks , and the area &#39; s natural beauty can be seen at upper barrakka gardens and st george &#39; s beach . malta national aquarium and palazzo parisio & gardens are also worth visiting . scuba diving , snorkeling , and water skiing offer great chances t o get out on the surrounding water , or you can seek out an adventure with mountain biking nearby . our guests appreciate the hotel &#39; s quiet location .	1
Located in Pembroke, Royal Palms Hotel is near the beach. The area&#39;s natural beauty can be seen at Elbow Beach and Horseshoe Bay. Bermuda Aquarium Museum and Zoo (BAMZ) and Devil&#39;s Hole Aquarium are also worth visiting. Kayaking and scuba diving offer great chances to get out on the surrounding water, or you can seek out an adventure with hiking/biking trails and rock climbing nearby. 	located in pembroke , royal palms hotel is near the beach . the area &#39; s natural beauty can be seen at elbow beach and horseshoe bay . bermuda aquarium museum and zoo -lrb- bamz -rrb- and devil &#39; s hole aquari um are also worth visiting . kayaking and scuba diving offer great chances to get out on the surrounding water , or you can seek out an adventure with hiking/biking trails and rock climbing nearby .	1
"Located in Providenciales, Royal West Indies Resort is on the beach. While the natural beauty of Grace Bay Beach and Long Bay Beach can be enjoyed by anyone, those looking for an activity can check out Turtle Cove. 
With scuba diving and parasailing nearby, you&#39;ll find plenty of adventures in the water. "	located in providenciales , royal west indies resort is on the beach . while the natural beauty of grace bay beach and long bay beach can be enjoyed by anyone , those looking for an activity can check ou t turtle cove . with scuba diving and parasailing nearby , you &#39; ll find plenty of adventures in the water .	1
Located in Freeport, Bell Channel Inn Hotel &amp; Scuba Diving Retreat is in the entertainment district and on the waterfront. Cooper&#39;s Castle is a notable landmark, and the area&#39;s natural beauty can be seen at Lucaya Beach and Treasure Reef. Don&#39;t miss out on a visit to Perfume Factory of Fragrances. With parasailing and boat tours nearby, you&#39;ll find plenty of adventures in the water. 	located in freeport , bell channel inn hotel & scuba diving retreat is in the entertainment district and on the waterfront . cooper &#39; s castle is a notable landmark , and the area &#39; s natural bea uty can be seen at lucaya beach and treasure reef . don &#39; t miss out on a visit to perfume factory of fragrances . with parasailing and boat tours nearby , you &#39; ll find plenty of adventures in the w ater .	1
Located in Southampton, The Reefs Hotel and Club is on the beach. King&#39;s Wharf in Dockyard is a notable landmark, and the area&#39;s natural beauty can be seen at Horseshoe Bay and Elbow Beach. Dolphin Quest and Bermuda Aquarium Museum and Zoo (BAMZ) are also worth visiting. With parasailing, windsurfing, and sailing nearby, you&#39;ll find plenty of adventures in the water. 	located in southampton , the reefs hotel and club is on the beach . king &#39; s wharf in dockyard is a notable landmark , and the area &#39; s natural beauty can be seen at horseshoe bay and elbow beach . do lphin quest and bermuda aquarium museum and zoo -lrb- bamz -rrb- are also worth visiting . with parasailing , windsurfing , and sailing nearby , you &#39; ll find plenty of adventures in the water .	1
Toby&#39;s Resort is located near the beach and in an area with good airport proximity. Montego Bay Cruise Ship Terminal and Tryall Golf Club are worth checking out if an activity is on the agenda, while those wishing to experience the area&#39;s natural beauty can explore Montego Bay Marine Park and Dead End Beach. AquaSol Theme Park and Rocklands Bird Sanctuary are also worth visiting. Looking to get your feet wet? Snorkeling, parasailing and windsurfing adventures can be found near the property. 	toby &#39; s resort is located near the beach and in an area with good airport proximity . montego bay cruise ship terminal and tryall golf club are worth checking out if an activity is on the agenda , wh ile those wishing to experience the area &#39; s natural beauty can explore montego bay marine park and dead end beach . aquasol theme park and rocklands bird sanctuary are also worth visiting . looking t o get your feet wet ? snorkeling , parasailing and windsurfing adventures can be found near the property .	1
Located in Pembroke, Rosedon Hotel is in the city center and near the beach. Gibb&#39;s Hill Lighthouse and Fort St. Catherine and Museum are notable landmarks, and the area&#39;s natural beauty can be seen at Elbow Beach and Horseshoe Bay. Bermuda Aquarium Museum and Zoo (BAMZ) and Devil&#39;s Hole Aquarium are also worth visiting. Kayaking and scuba diving offer great chances to get out on the surrounding water, or you can seek out an adventure with mountain biking and cave exploring nearby. 	located in pembroke , rosedon hotel is in the city center and near the beach . gibb &#39; s hill lighthouse and fort st. catherine and museum are notable landmarks , and the area &#39; s natural beauty can b e seen at elbow beach and horseshoe bay . bermuda aquarium museum and zoo -lrb- bamz -rrb- and devil &#39; s hole aquarium are also worth visiting . kayaking and scuba diving offer great chances to get out on the s urrounding water , or you can seek out an adventure with mountain biking and cave exploring nearby .	1
Located in Paget, Inverurie Executive Suites is near the beach. King&#39;s Wharf in Dockyard is a notable landmark, and the area&#39;s natural beauty can be seen at Elbow Beach and Horseshoe Bay. Bermuda Aquarium Museum and Zoo (BAMZ) and Devil&#39;s Hole Aquarium are also worth visiting. Our guests appreciate the hotel&#39;s quiet location. 	located in paget , inverurie executive suites is near the beach . king &#39; s wharf in dockyard is a notable landmark , and the area &#39; s natural beauty can be seen at elbow beach and horseshoe bay . berm uda aquarium museum and zoo -lrb- bamz -rrb- and devil &#39; s hole aquarium are also worth visiting . our guests appreciate the hotel &#39; s quiet location .	1
Located in Gros Islet, Coco Palm is near the beach. Shoppers can check out Castries Central Market, while everyone can enjoy the natural beauty of Reduit Beach and Vigie Beach. Splash Island Water Park Saint Lucia and Rodney Bay Aquatic Centre are also worth visiting. Scuba diving, snorkeling, and water skiing offer great chances to get out on the surrounding water, or you can seek out an adventure with hiking/biking trails nearby. 	located in gros islet , coco palm is near the beach . shoppers can check out castries central market , while everyone can enjoy the natural beauty of reduit beach and vigie beach . splash island water par k saint lucia and rodney bay aquatic centre are also worth visiting . scuba diving , snorkeling , and water skiing offer great chances to get out on the surrounding water , or you can seek out an adventur e with hiking/biking trails nearby .	1
Halcyon Palm is located near the beach and in a walkable area with good shopping. Sunset Crest Shopping Centre and Chattel Village are worth checking out if shopping is on the agenda, while those wishing to experience the area&#39;s natural beauty can explore Sandy Lane Beach. Looking to enjoy an event or a game while in town? See what&#39;s going on at Kensington Oval. Kayaking, scuba diving, and snorkeling offer great chances to get out on the surrounding water, or you can seek out an adventure with ecotours nearby. 	halcyon palm is located near the beach and in a walkable area with good shopping . sunset crest shopping centre and chattel village are worth checking out if shopping is on the agenda , while those wish ing to experience the area &#39; s natural beauty can explore sandy lane beach . looking to enjoy an event or a game while in town ? see what &#39; s going on at kensington oval . kayaking , scuba diving , and snorkeling offer great chances to get out on the surrounding water , or you can seek out an adventure with ecotours nearby .	1
Located in St. Paul&#39;s Bay, Hotel Santana is in the city center and near the beach. Bugibba Square and St. Paul&#39;s Cathedral are notable landmarks, and the area&#39;s natural beauty can be seen at Golden Sands Beach and Mellieha Bay. Don&#39;t miss out on a visit to Malta National Aquarium. Take an opportunity to explore the area for water adventures such as boat tours. 	located in st. paul &#39; s bay , hotel santana is in the city center and near the beach . bugibba square and st. paul &#39; s cathedral are notable landmarks , and the area &#39; s natural beauty can be seen at golden sands beach and mellieha bay . don &#39; t miss out on a visit to malta national aquarium . take an opportunity to explore the area for water adventures such as boat tours .	1
Located in St. Paul&#39;s Bay, Dolmen Hotel Malta is connected to the convention center. St. Paul&#39;s Cathedral and Sliema Promenade are notable landmarks, and some of the area&#39;s activities can be experienced at Grand Harbour and Sliema Ferry. Traveling with kids? Consider Malta National Aquarium and Mediterraneo Marine Park. Spend some time exploring the area&#39;s activities, including golf lessons and golfing. Our guests appreciate the hotel&#39;s central location. 	located in st. paul &#39; s bay , dolmen hotel malta is connected to the convention center . st. paul &#39; s cathedral and sliema promenade are notable landmarks , and some of the area &#39; s activities can be experienced at grand harbour and sliema ferry . traveling with kids ? consider malta national aquarium and mediterraneo marine park . spend some time exploring the area &#39; s activities , including gol f lessons and golfing . our guests appreciate the hotel &#39; s central location .	1
"Located in Tamarindo, Jardín del Edén Boutique Hotel - Adults Only is near the airport and near the beach. While the natural beauty of Tamarindo Beach and Playa Brasilito can be enjoyed by anyone, those looking for an activity can check out Hacienda Pinilla Golf Course. 
Tamarindo Church and Canopy Vista Tamarindo are also worth visiting. Scuba diving offers a great chance to get out on the surrounding water, or you can seek out an adventure with ziplining nearby. "	located in tamarindo , jardín del edén boutique hotel - adults only is near the airport and near the beach . while the natural beauty of tamarindo beach and playa brasilito can be enjoyed by anyone , tho se looking for an activity can check out hacienda pinilla golf course . tamarindo church and canopy vista tamarindo are also worth visiting . scuba diving offers a great chance to get out on the surrou nding water , or you can seek out an adventure with ziplining nearby .	1
Located in Santo Domingo, Dominican Fiesta Hotel &amp; Casino is connected to the convention center. National Zoological Park (ZOODOM) and National Aquarium are local attractions and those in the mood for shopping can visit Acropolis Center and Sambil Santo Domingo. Traveling with kids? Consider Agua Splash Caribe Aquatic Park, or check out an event or a game at Centro Olimpico. 	located in santo domingo , dominican fiesta hotel & casino is connected to the convention center . national zoological park -lrb- zoodom -rrb- and national aquarium are local attractions and those in the mood for shopping can visit acropolis center and sambil santo domingo . traveling with kids ? consider agua splash caribe aquatic park , or check out an event or a game at centro olimpico .	1
