A wonderful easy standard in our rotation of meals. Don't change the ingredients but I do have a few tips for easy prep: I double this and put the chicken sun-dried tomatoes and SDT oil and all remaining ingredients (except parm and noodles) into 2 large zip lock bags. I throw 1 bag in the fridge until I'm ready to cook it in the evening and the other bag goes into the freezer. When I go to make this meal again in the future I pull out the frozen bag and thaw it which also marinates the meat a the same time. I heat a pan dump it in and it's done even before the noodles!!	a wonderful easy standard in our rotation of meals . do n't change the ingredients but i do have a few tips for easy prep : i double this and put the chicken sun-dried tomatoes and sdt oil and all remain ing ingredients -lrb- except parm and noodles -rrb- into 2 large zip lock bags . i throw 1 bag in the fridge until i 'm ready to cook it in the evening and the other bag goes into the freezer . when i go to make t his meal again in the future i pull out the frozen bag and thaw it which also marinates the meat a the same time . i heat a pan dump it in and it 's done even before the noodles !!	1
Very tasty and quick recipe. I put the chicken oil from the sun-dried tomatoes and herbs into a large zip lock bag a marinated it in the refrigerator for an hour before cooking. I also added some red pepper flakes to spice it up. I made the Garden Herb Loaf from this site to serve with it. Between the colorful pasta and the pretty herb bread that was a quick braided loaf it was a beautiful presentation. Thanks Cindy.	very tasty and quick recipe . i put the chicken oil from the sun-dried tomatoes and herbs into a large zip lock bag a marinated it in the refrigerator for an hour before cooking . i also added some red pepper flakes to spice it up . i made the garden herb loaf from this site to serve with it . between the colorful pasta and the pretty herb bread that was a quick braided loaf it was a beautiful present ation . thanks cindy .	1
Very delicious but does not do well made ahead of time. The pasta gets chewy and the chicken gets dry. My whole family loves it!! My brother is very finicky and he loved it. I added artichokes when adding the sun dried tomatoes. Very Yummy!!!	very delicious but does not do well made ahead of time . the pasta gets chewy and the chicken gets dry . my whole family loves it !! my brother is very finicky and he loved it . i added artichokes when ad ding the sun dried tomatoes . very yummy !!!	1
This dish gets too dry if you drain the oil after cooking the chicken. Otherwise full of flavor and delightful.	this dish gets too dry if you drain the oil after cooking the chicken . otherwise full of flavor and delightful .	1
I give this recipe four stars only because I didn't follow it exactly. I hate sun dried tomatoes so instead I cooked some fresh chopped spinach. Also I only had a bag of frozen chicken breasts and no time to thaw so I baked the chicken with some Italian salad dressing drizzled over the tops. Other than that I followed everything in the recipe. It was delicious!!!!! First time I've ever had pasta that wasn't slathered in some sort of sauce! Definitely will be making this again.	i give this recipe four stars only because i did n't follow it exactly . i hate sun dried tomatoes so instead i cooked some fresh chopped spinach . also i only had a bag of frozen chicken breasts and no time to thaw so i baked the chicken with some italian salad dressing drizzled over the tops . other than that i followed everything in the recipe . it was delicious !!!!! first time i 've ever had pasta t hat was n't slathered in some sort of sauce ! definitely will be making this again .	1
Very good! I made it with penne pasta since this is all I had. I did not have sun dried tomatoes so I did what another reviewer did and added some spinach and also some grape tomatoes halved. I had some Italian spice mixes that I used in there instead of the oregano and basil. A little dry after it was mixed so I added a drizzle of evoo. Wish I would have had some garlic bread for this!!:)	very good ! i made it with penne pasta since this is all i had . i did not have sun dried tomatoes so i did what another reviewer did and added some spinach and also some grape tomatoes halved . i had so me italian spice mixes that i used in there instead of the oregano and basil . a little dry after it was mixed so i added a drizzle of evoo . wish i would have had some garlic bread for this !! :-rrb-	1
Quick and easy my family loved it. I didn't have any oyster sauce so I just used a little more Soy. Delicous.	quick and easy my family loved it . i did n't have any oyster sauce so i just used a little more soy . delicous .	1
The bok choy turn too soft if cook on the same time with broccoli. What I did I steam the broccoli for a moment then add to the chicken the same time with bok choy only for several minutes. It works well for me.All veggie still crispy.	the bok choy turn too soft if cook on the same time with broccoli . what i did i steam the broccoli for a moment then add to the chicken the same time with bok choy only for several minutes . it works w ell for me.all veggie still crispy .	1
The first time I made this it wasn't horrible it's just the second time around it was so much better. This recipe is excellent after you alter slightly. On it's own the pepper can be a little dominant as far as taste and bok choy doesn't seem necessary. My suggestion is use more soy and oyster sauce cut out the pepper and leave the bok choy optional. After that it was sensational. Adding a little more sugar and a chicken bouillon cube to the water doesn't hurt either.	the first time i made this it was n't horrible it 's just the second time around it was so much better . this recipe is excellent after you alter slightly . on it 's own the pepper can be a little dominant as far as taste and bok choy does n't seem necessary . my suggestion is use more soy and oyster sauce cut out the pepper and leave the bok choy optional . after that it was sensational . adding a little more sugar and a chicken bouillon cube to the water does n't hurt either .	1
I've been making stir-fry's since I started cooking and this was by far the best one that's ever come out of my kitchen. I put it over chow mein noodles. This is the best!	i 've been making stir-fry 's since i started cooking and this was by far the best one that 's ever come out of my kitchen . i put it over chow mein noodles . this is the best !	1
I'm not sure why since all the right ingredients seemed to be here but this was really kind of boring. I would have thought the oyster sauce soy sauce and garlic all would have contributed great flavor but it all just sort of got lost. Perhaps some sherry toasted sesame oil and chicken broth would have helped. I did back off the pepper which seemed excessive because as the saying goes you can always add more but you can't take it away. I also steered away from the cooking method as directed. Since some of the ingredients require different cooking times I cooked them separately then combined it all at the end. I added mushrooms and served this over rice noodles which was a nice combo but unfortunately tonight's dinner was rather forgettable.	i 'm not sure why since all the right ingredients seemed to be here but this was really kind of boring . i would have thought the oyster sauce soy sauce and garlic all would have contributed great flavo r but it all just sort of got lost . perhaps some sherry toasted sesame oil and chicken broth would have helped . i did back off the pepper which seemed excessive because as the saying goes you can alwa ys add more but you ca n't take it away . i also steered away from the cooking method as directed . since some of the ingredients require different cooking times i cooked them separately then combined it all at the end . i added mushrooms and served this over rice noodles which was a nice combo but unfortunately tonight 's dinner was rather forgettable .	1
Awesome! I marinaded the chicken in oyster sauce soy sauce and garlic paste overnight. I added more during the cooking when I saw it wasn't going to be saucy enough. I didn't need to add any cornstarch as it thickened up quite nicely on its own. Finally I found that the bok choy needed very very little cooking - I stirred it in covered the pan for about 3 mins and it was tender crisp. Perfect! This would be great with carrots peppers bean sprouts mushrooms etc and I would be interested in making it again with a handful of chopped peanuts or cashews. Very versatile! Thanks unieng!	awesome ! i marinaded the chicken in oyster sauce soy sauce and garlic paste overnight . i added more during the cooking when i saw it was n't going to be saucy enough . i did n't need to add any cornstarc h as it thickened up quite nicely on its own . finally i found that the bok choy needed very very little cooking - i stirred it in covered the pan for about 3 mins and it was tender crisp . perfect ! thi s would be great with carrots peppers bean sprouts mushrooms etc and i would be interested in making it again with a handful of chopped peanuts or cashews . very versatile ! thanks unieng !	1
Excellent stir fry. My husband and I loved it. And the possibilities with this are endless -- next time I might make it spicy with red pepper flakes and add some peanuts.	excellent stir fry . my husband and i loved it . and the possibilities with this are endless -- next time i might make it spicy with red pepper flakes and add some peanuts .	1
I loved this but I've turned it into a stir fry. I added red and green peppers waterchestnuts zuccini squash and mushrooms. Also with the cornstarch mix i add a teaspoon of spicy chili sauce little more oyster sauce sesame oil and sesame seeds. This is a great touch for flavor.	i loved this but i 've turned it into a stir fry . i added red and green peppers waterchestnuts zuccini squash and mushrooms . also with the cornstarch mix i add a teaspoon of spicy chili sauce little mo re oyster sauce sesame oil and sesame seeds . this is a great touch for flavor .	1
I used cilantro in place of oregano (didn't have any) and I added about 1 TBSP of Chili Powder.  It turned out great! We added the Chili Powder because the broth had an odd look to it with white chicken, white hominy, clear chicken broth and green chilis (kind of a green cast).  My son didn't like the look, so I added chili powder -- he loved it and asked me to make it again.	i used cilantro in place of oregano -lrb- did n't have any -rrb- and i added about 1 tbsp of chili powder . it turned out great ! we added the chili powder because the broth had an odd look to it with white chick en , white hominy , clear chicken broth and green chilis -lrb- kind of a green cast -rrb- . my son did n't like the look , so i added chili powder -- he loved it and asked me to make it again .	1
I thought this was great. I shredded already cooked chicken meat from a deli chicken and threw everything into the crock pot and set it on low for a few hours. Yummy!	i thought this was great . i shredded already cooked chicken meat from a deli chicken and threw everything into the crock pot and set it on low for a few hours . yummy !	1
Great recipe. Quick and surprisingly good given the short cooking time. I was looking for a more traditional posole so I made a few changes: omitted the green chiles and olives added about 1/3 of a can of red enchilada sauce and topped with chopped cabbage and radishes. This is most definitely a make-again recipe.	great recipe . quick and surprisingly good given the short cooking time . i was looking for a more traditional posole so i made a few changes : omitted the green chiles and olives added about 1/3 of a ca n of red enchilada sauce and topped with chopped cabbage and radishes . this is most definitely a make-again recipe .	1
This was so good and super easy. I added a can of pinto beans to make it a little more substantial and my husband and I both loved it!	this was so good and super easy . i added a can of pinto beans to make it a little more substantial and my husband and i both loved it !	1
very easy and very good. My husband and kids loved it.	very easy and very good . my husband and kids loved it .	1
This was a quick and easy supper. After tasting I tripled the cumin and garlic but DH and I both thought it still lacked flavor. We served it over rice which we thought made it more of a hearty meal. He added Sriracha hot sauce to his. I added chipotle powder red pepper flakes and plain nonfat yogurt to mine. After these additions we thought it was good but probably won't make again.	this was a quick and easy supper . after tasting i tripled the cumin and garlic but dh and i both thought it still lacked flavor . we served it over rice which we thought made it more of a hearty meal . he added sriracha hot sauce to his . i added chipotle powder red pepper flakes and plain nonfat yogurt to mine . after these additions we thought it was good but probably wo n't make again .	1
I made this for dinner and it turned out really well. It was filling enough for a main course and we used the leftovers as a side salad the next day when we barbequed hamburgers. I added diced tomatoes and 1/2 cup of sun dried tomatoes to it as well and it was delicious.	i made this for dinner and it turned out really well . it was filling enough for a main course and we used the leftovers as a side salad the next day when we barbequed hamburgers . i added diced tomatoe s and 1/2 cup of sun dried tomatoes to it as well and it was delicious .	1
Great Pasta salad. Used leftover BBQ chicken and added tomatoes green pepper artichoke hearts and feta cheese to the other ingredients.	great pasta salad . used leftover bbq chicken and added tomatoes green pepper artichoke hearts and feta cheese to the other ingredients .	1
I love this recipe. I tried it out and it was so tasty. I could eat this over and over again. I don't always use olives and tomatoes seems like it might be overkill but when cooking the chicken I use sesame seed oil rice wine vinegar and some soy sauce as well as a bit of powdered ginger for a boost of flavor for the chicken all by itself. This is an excellent recipe.	i love this recipe . i tried it out and it was so tasty . i could eat this over and over again . i do n't always use olives and tomatoes seems like it might be overkill but when cooking the chicken i use sesame seed oil rice wine vinegar and some soy sauce as well as a bit of powdered ginger for a boost of flavor for the chicken all by itself . this is an excellent recipe .	1
This was absolutely delicious. I added cherry tomatoes and used 2 cups of bowtie pasta. I also seasoned the chicken with soy sauce and a little garlic before adding to the salad. Would make again.	this was absolutely delicious . i added cherry tomatoes and used 2 cups of bowtie pasta . i also seasoned the chicken with soy sauce and a little garlic before adding to the salad . would make again .	1
My Mom and Dad really liked this but I just thought it was OK. I kept thinking that it needed something like maybe some buffalo mozzeralla cut into cubes but both of my parents thought it was great as it was. We used 1 cup of chicken from a rotisserie chicken. I mixed the veggies with the dressing and put it in the fridge for an hour or so before we were ready to serve. I also cooked the pasta drained it and put it in the fridge an hour ahead of time. It helped to make the salad nicely chilled and helped to combine the flavors. I will probably make again for my hubby with the addition of the cheese.	my mom and dad really liked this but i just thought it was ok . i kept thinking that it needed something like maybe some buffalo mozzeralla cut into cubes but both of my parents thought it was great as it was . we used 1 cup of chicken from a rotisserie chicken . i mixed the veggies with the dressing and put it in the fridge for an hour or so before we were ready to serve . i also cooked the pasta dra ined it and put it in the fridge an hour ahead of time . it helped to make the salad nicely chilled and helped to combine the flavors . i will probably make again for my hubby with the addition of the c heese .	1
This was excellent. My whole family loved it. I served it over sweet baby lettuce and added some balsamic vinagrette. I will make this over and over again.	this was excellent . my whole family loved it . i served it over sweet baby lettuce and added some balsamic vinagrette . i will make this over and over again .	1
I didn't have olives or sunflower seeds. I used elbow macaroni and added steamed broccoli. I included carrots and tomatoes to add color to the salad. Glad to have a macaroni salad that doesn't have mayonnaise in it. Ingredients don't have to be measured. I would make this again just as tasty the next day.	i did n't have olives or sunflower seeds . i used elbow macaroni and added steamed broccoli . i included carrots and tomatoes to add color to the salad . glad to have a macaroni salad that does n't have ma yonnaise in it . ingredients do n't have to be measured . i would make this again just as tasty the next day .	1
This salad is delicious! I served it to my husband and brother and they both loved it. I did change a little bit of it though. I used Sun-Dried Tomato Chicken Sausage and a green pepper (that's what I had). It was great! I think this salad would be good with pineapple mandarin oranges and lots of other stuff. Thanks for sharing!	this salad is delicious ! i served it to my husband and brother and they both loved it . i did change a little bit of it though . i used sun-dried tomato chicken sausage and a green pepper -lrb- that 's what i had -rrb- . it was great ! i think this salad would be good with pineapple mandarin oranges and lots of other stuff . thanks for sharing !	1
Yum! I used whole wheat ziti instead of seashell pasta added mushrooms and used green olives because I was out of black. The sunflower seeds add a nice flavor/crunch. Thanks:)	yum ! i used whole wheat ziti instead of seashell pasta added mushrooms and used green olives because i was out of black . the sunflower seeds add a nice flavor/crunch . thanks :-rrb-	1
Did this recipe twice. First time to me was 4-star. To make it 5-star for my family and I I ditched the cornmeal subbed buttermilk for the regular milk and doubled it and used a LOT more cayenne (bringing it closer to the recipe I've always used). Follow the actual process of preparing the tomatoes and cooking them. These steps are very important and Chef John has laid them out very well. When finished I used my own remoulade recipe (relish mayo lemon juice hot sauce cayenne paprika s&p blended smooth) and stacked my tomatoes with crab cakes with the remoulade (mixed with tiny salad shrimp) over all. DELISH!!!!	did this recipe twice . first time to me was 4 star . to make it 5 star for my family and i i ditched the cornmeal subbed buttermilk for the regular milk and doubled it and used a lot more cayenne -lrb- brin ging it closer to the recipe i 've always used -rrb- . follow the actual process of preparing the tomatoes and cooking them . these steps are very important and chef john has laid them out very well . when fin ished i used my own remoulade recipe -lrb- relish mayo lemon juice hot sauce cayenne paprika s & p blended smooth -rrb- and stacked my tomatoes with crab cakes with the remoulade -lrb- mixed with tiny salad shrimp -rrb- ov er all . delish !!!!	1
These were the BEST fried green tomatoes that I've ever had! My family loved them. I paired it with Chef Johns crockpot pot roast (made mine in the oven and tweek'd it a bit with beer) with mashed potatoes mushrooms onions and carrots. It was delicious!!!!	these were the best fried green tomatoes that i 've ever had ! my family loved them . i paired it with chef johns crockpot pot roast -lrb- made mine in the oven and tweek 'd it a bit with beer -rrb- with mashed pot atoes mushrooms onions and carrots . it was delicious !!!!	1
I have always wanted to try fried greens since the movie came out and finally with the help of Chef John hilarious video I took the leap. I was not expecting much just a novelty food and I was pleasantly surprised--these things are pretty good. Will have to work on my southern drawl next. Another home run--thanks Chef John	i have always wanted to try fried greens since the movie came out and finally with the help of chef john hilarious video i took the leap . i was not expecting much just a novelty food and i was pleasan tly surprised -- these things are pretty good . will have to work on my southern drawl next . another home run -- thanks chef john	1
This recipe is excellent! I usually shy away from any vegetable but so very happy I tried these. This is the third time in a month!!! It is a wonderful way to use up those end of the season green tomatoes in the garden. Did not change anything in the recipe. Just make and enjoy! Thanks Chef John.	this recipe is excellent ! i usually shy away from any vegetable but so very happy i tried these . this is the third time in a month !!! it is a wonderful way to use up those end of the season green toma toes in the garden . did not change anything in the recipe . just make and enjoy ! thanks chef john .	1
These were so easy and delicious even for a novice like me! I would not change a thing! I followed the directions EXACTLY setting out the tomatoes to drain keeping them in the flour for a while pushing in the cornmeal and this is the first time the coating didn't come off something I was trying to fry! I made these to accompany Chef John's Crab Cakes which were also wonderful!	these were so easy and delicious even for a novice like me ! i would not change a thing ! i followed the directions exactly setting out the tomatoes to drain keeping them in the flour for a while pushin g in the cornmeal and this is the first time the coating did n't come off something i was trying to fry ! i made these to accompany chef john 's crab cakes which were also wonderful !	1
Best fried green tomatoes!!! Really enjoyed the sauce as well. Thanks!	best fried green tomatoes !!! really enjoyed the sauce as well . thanks !	1
This is the first time I've tried fried green tomatoes. Absolutely a new favorite!	this is the first time i 've tried fried green tomatoes . absolutely a new favorite !	1
Always wanted to try since the movie. Maybe just because it's not my thing but these didn't taste good to me.	always wanted to try since the movie . maybe just because it 's not my thing but these did n't taste good to me .	1
This ranks up there with my all time favorite soups. First of all, double the recipe, it's too much trouble and too good to only get 4 servings out of this soup. To help you decide how much pepper to use, use the full amount of ancho chili pepper.  Ancho chili pepper only adds depth of flavor not heat.  I did cut in half the chipotle chili pepper (that is where the heat is.  I used the full amount of cayenne.  I added a diced red pepper as I sautéed the onion. When you add the beans also add 2 cups of white frozen corn. For the garnish also use broken lime tortilla chips.  I promise, doing it this way will not be too spicy hot but just wonderful.	this ranks up there with my all time favorite soups . first of all , double the recipe , it 's too much trouble and too good to only get 4 servings out of this soup . to help you decide how much pepper to use , use the full amount of ancho chili pepper . ancho chili pepper only adds depth of flavor not heat . i did cut in half the chipotle chili pepper -lrb- that is where the heat is . i used the full amount of cayenne . i added a diced red pepper as i sautéed the onion . when you add the beans also add 2 cups of white frozen corn . for the garnish also use broken lime tortilla chips . i promise , doing it this way will not be too spicy hot but just wonderful .	2
This was fantastic! Absolutely delicious I loved it! Need I say more? I was worried because I don't like chipolte but this definitely worked well together. So light and yummy!	this was fantastic ! absolutely delicious i loved it ! need i say more ? i was worried because i do n't like chipolte but this definitely worked well together . so light and yummy !	1
This was a win!!! I sautéed cubed chicken and seasoned it with regular chili powder (all I had on hand) garlic powder cayenne pepper and cumin (eyeballed amounts) I subbed a can of diced tomato for 1 cup of the chicken broth...kept everything else the same...quick easy weeknight meal!	this was a win !!! i sautéed cubed chicken and seasoned it with regular chili powder -lrb- all i had on hand -rrb- garlic powder cayenne pepper and cumin -lrb- eyeballed amounts -rrb- i subbed a can of diced tomato for 1 cup of the chicken broth ... kept everything else the same ... quick easy weeknight meal !	1
