Located in Ciudad Cariari, Country Inn &amp; Suites by Radisson, San Jose Aeropuerto, Costa Rica is connected to the convention center. Plaza Real Cariari and Multiplaza Mall Escazu are worth checking out if shopping is on the agenda, while those wishing to experience the area&#39;s natural beauty can explore Morazan Park and Parque Nacional. Looking to enjoy an event or a game while in town? See what&#39;s going on at Costa Rica National Stadium (Estadio Nacional de Costa Rica), or consider a night out at Parque Viva. Break out the clubs and hit the links with a golf course nearby, or seek out an adventure with ecotours. 	located in ciudad cariari , country inn & suites by radisson , san jose aeropuerto , costa rica is connected to the convention center . plaza real cariari and multiplaza mall escazu are worth checking out if shopping is on the agenda , while those wishing to experience the area &#39; s natural beauty can explore morazan park and parque nacional . looking to enjoy an event or a game while in town ? see what &#39; s going on at costa rica national stadium -lrb- estadio nacional de costa rica -rrb- , or consider a night out at parque viva . break out the clubs and hit the links with a golf course nearby , or seek ou t an adventure with ecotours .	1
Located in St. Paul&#39;s Bay, AX │ Seashells Resort at Suncrest is in the entertainment district and on the waterfront. The area&#39;s natural beauty can be seen at Bugibba Beach and Golden Sands Beach, while Malta Experience and Fort St. Elmo are cultural highlights. Traveling with kids? Consider Malta National Aquarium and Birdpark Malta. Jet skiing and kayaking offer great chances to get out on the surrounding water, or you can seek out an adventure with mountain biking and hiking/biking trails nearby. 	located in st. paul &#39; s bay , ax │ seashells resort at suncrest is in the entertainment district and on the waterfront . the area &#39; s natural beauty can be seen at bugibba beach and golden sands bea ch , while malta experience and fort st. elmo are cultural highlights . traveling with kids ? consider malta national aquarium and birdpark malta . jet skiing and kayaking offer great chances to get out o n the surrounding water , or you can seek out an adventure with mountain biking and hiking/biking trails nearby .	1
"Located in Gros Islet, The Ginger Lily Hotel is near the beach. While the natural beauty of Reduit Beach and Pigeon Island National Park can be enjoyed by anyone, those looking for an activity can check out Rodney Bay Marina. 
Looking to enjoy an event or a game while in town? See what&#39;s going on at Daren Sammy Cricket Ground. With kayaking, scuba diving, and parasailing nearby, you&#39;ll find plenty of adventures in the water. "	located in gros islet , the ginger lily hotel is near the beach . while the natural beauty of reduit beach and pigeon island national park can be enjoyed by anyone , those looking for an activity can che ck out rodney bay marina . looking to enjoy an event or a game while in town ? see what &#39; s going on at daren sammy cricket ground . with kayaking , scuba diving , and parasailing nearby , you &#39; ll fin d plenty of adventures in the water .	1
Located in Soufriere, Fond Doux Plantation &amp; Resort is in the historical district and near the beach. The area&#39;s natural beauty can be seen at Gros Piton and Anse Chastanet Beach. Discover the area&#39;s water adventures with scuba diving, snorkeling, and water skiing nearby, or enjoy the great outdoors with ecotours. Our guests appreciate the hotel&#39;s location for the sightseeing. 	located in soufriere , fond doux plantation & resort is in the historical district and near the beach . the area &#39; s natural beauty can be seen at gros piton and anse chastanet beach . discover the area &#39; s water adventures with scuba diving , snorkeling , and water skiing nearby , or enjoy the great outdoors with ecotours . our guests appreciate the hotel &#39; s location for the sightseeing .	1
Located in St. Paul&#39;s Bay, AX │ Sunny Coast Resort &amp; Spa is on the boardwalk. Fort St. Elmo and Malta Experience are cultural highlights, and some of the area&#39;s activities can be experienced at Grand Harbour and Sliema Ferry. Traveling with kids? Consider Malta National Aquarium and Birdpark Malta. 	located in st. paul &#39; s bay , ax │ sunny coast resort & spa is on the boardwalk . fort st. elmo and malta experience are cultural highlights , and some of the area &#39; s activities can be experienc ed at grand harbour and sliema ferry . traveling with kids ? consider malta national aquarium and birdpark malta .	1
In the city center and near a metro station, ibis Singapore On Bencoolen is in an area with good airport proximity and shopping. National Museum of Singapore and National Gallery Singapore are cultural highlights, and some of the area&#39;s notable landmarks include Merlion and Marina Bay Sands Skypark. Singapore Flyer and Universal Studios Singapore™ are not to be missed. Our guests appreciate the hotel&#39;s central location. 	in the city center and near a metro station , ibis singapore on bencoolen is in an area with good airport proximity and shopping . national museum of singapore and national gallery singapore are cultura l highlights , and some of the area &#39; s notable landmarks include merlion and marina bay sands skypark . singapore flyer and universal studios singapore ™ are not to be missed . our guests appreciate th e hotel &#39; s central location .	1
Located in Santo Domingo, W&amp;P Santo Domingo is in the city center and near the boardwalk. National Palace and Cathedral of Santo Domingo are notable landmarks, and the area&#39;s natural beauty can be seen at Parque Colon. Looking to enjoy an event or a game? See what&#39;s going on at Centro Olimpico or Quisqueya Stadium. Spend some time exploring the area&#39;s activities, including golf lessons and golfing. 	located in santo domingo , w&p santo domingo is in the city center and near the boardwalk . national palace and cathedral of santo domingo are notable landmarks , and the area &#39; s natural beauty ca n be seen at parque colon . looking to enjoy an event or a game ? see what &#39; s going on at centro olimpico or quisqueya stadium . spend some time exploring the area &#39; s activities , including golf les sons and golfing .	1
San Bosco Inn is located near the boardwalk and in an area with good shopping. The area&#39;s natural beauty can be seen at Arenal Volcano and La Fortuna Waterfall. Mistico Arenal Hanging Bridges Park and Arenal Adventure World are also worth visiting. Discover the area&#39;s water adventures with kayaking and rafting nearby, or enjoy the great outdoors with hiking/biking trails and mountain biking. Our guests love the hotel&#39;s central location. 	san bosco inn is located near the boardwalk and in an area with good shopping . the area &#39; s natural beauty can be seen at arenal volcano and la fortuna waterfall . mistico arenal hanging bridges park and arenal adventure world are also worth visiting . discover the area &#39; s water adventures with kayaking and rafting nearby , or enjoy the great outdoors with hiking/biking trails and mountain bikin g . our guests love the hotel &#39; s central location .	1
Located in Paget, Newstead Belmont Hills Golf Resort &amp; Spa is near the beach. The area&#39;s natural beauty can be seen at Elbow Beach and Horseshoe Bay. Bermuda Aquarium Museum and Zoo (BAMZ) and Devil&#39;s Hole Aquarium are also worth visiting. Looking to get your feet wet? Parasailing, windsurfing and sailing adventures can be found near the property. Our guests appreciate the hotel&#39;s location for the sightseeing. 	located in paget , newstead belmont hills golf resort & spa is near the beach . the area &#39; s natural beauty can be seen at elbow beach and horseshoe bay . bermuda aquarium museum and zoo -lrb- bamz -rrb- and devil &#39; s hole aquarium are also worth visiting . looking to get your feet wet ? parasailing , windsurfing and sailing adventures can be found near the property . our guests appreciate the hotel &#39; s location for the sightseeing .	1
Located in Jaco, Pumilio Mountain &amp; Ocean Hotel is in a rural area and on the riverwalk. Rainforest Adventures Costa Rica Pacific Park and Canopy Vista Los Suenos Adventure Park are worth checking out if an activity is on the agenda, while those wishing to experience the area&#39;s natural beauty can explore Herradura Beach and Jaco Beach. Traveling with kids? Consider Neo Fauna and Hacienda las Agujas. Kayaking and scuba diving offer great chances to get out on the surrounding water, or you can seek out an adventure with rock climbing and ziplining nearby. 	located in jaco , pumilio mountain & ocean hotel is in a rural area and on the riverwalk . rainforest adventures costa rica pacific park and canopy vista los suenos adventure park are worth checking out if an activity is on the agenda , while those wishing to experience the area &#39; s natural beauty can explore herradura beach and jaco beach . traveling with kids ? consider neo fauna and hacienda l as agujas . kayaking and scuba diving offer great chances to get out on the surrounding water , or you can seek out an adventure with rock climbing and ziplining nearby .	1
Hotel Jen Malé, Maldives by Shangri-La is located near the beach and in an area with good airport proximity. Maldives Islamic Centre is a notable landmark, and the area&#39;s natural beauty can be seen at Kurumba Beach and Hulhumale Beach. 	hotel jen malé , maldives by shangri-la is located near the beach and in an area with good airport proximity . maldives islamic centre is a notable landmark , and the area &#39; s natural beauty can be see n at kurumba beach and hulhumale beach .	1
Located in Jaco, Hotel Villa Creole is in the city center and near the beach. The area&#39;s natural beauty can be seen at Jaco Beach and Herradura Beach. Neo Fauna and Hacienda las Agujas are also worth visiting. Kayaking and scuba diving offer great chances to get out on the surrounding water, or you can seek out an adventure with ecotours and mountain biking nearby. 	located in jaco , hotel villa creole is in the city center and near the beach . the area &#39; s natural beauty can be seen at jaco beach and herradura beach . neo fauna and hacienda las agujas are also wo rth visiting . kayaking and scuba diving offer great chances to get out on the surrounding water , or you can seek out an adventure with ecotours and mountain biking nearby .	1
Located in Sliema, The Waterfront Hotel is in the city center and on the waterfront. The area&#39;s natural beauty can be seen at Upper Barrakka Gardens and St George&#39;s Beach, while Malta Experience and Fort St. Elmo are cultural highlights. Malta National Aquarium and Palazzo Parisio &amp; Gardens are also worth visiting. 	located in sliema , the waterfront hotel is in the city center and on the waterfront . the area &#39; s natural beauty can be seen at upper barrakka gardens and st george &#39; s beach , while malta experien ce and fort st. elmo are cultural highlights . malta national aquarium and palazzo parisio & gardens are also worth visiting .	1
Marina Bay Sands is located in Singapore&#39;s Marina Bay neighborhood. Marina Bay Sands Skypark and Merlion are notable landmarks, and travelers looking to shop may want to visit Raffles Place and Bugis Street Shopping District. Singapore Flyer and Universal Studios Singapore™ are not to be missed. 	marina bay sands is located in singapore &#39; s marina bay neighborhood . marina bay sands skypark and merlion are notable landmarks , and travelers looking to shop may want to visit raffles place and bu gis street shopping district . singapore flyer and universal studios singapore ™ are not to be missed .	1
Located in George Town, Hideaways Exuma is near the airport and on a private beach. Rolletown Tombs and Hermitage Tomb are local landmarks, and the area&#39;s natural beauty can be seen at Emerald Bay Beach and Tropic of Cancer Beach. Scuba diving and snorkeling offer great chances to get out on the surrounding water, or you can seek out an adventure with ecotours and hiking/biking trails nearby. 	located in george town , hideaways exuma is near the airport and on a private beach . rolletown tombs and hermitage tomb are local landmarks , and the area &#39; s natural beauty can be seen at emerald bay beach and tropic of cancer beach . scuba diving and snorkeling offer great chances to get out on the surrounding water , or you can seek out an adventure with ecotours and hiking/biking trails nearby .	1
In the city center and near a metro station, V Hotel Lavender is in a walkable area with good airport proximity. National Museum of Singapore and National Gallery Singapore are cultural highlights, and some of the area&#39;s activities can be experienced at Boat Quay and Marina Bay Cruise Centre Singapore. Singapore Flyer and National Orchid Garden are not to be missed. Spend some time exploring the area&#39;s activities, including outlet shopping. Our guests appreciate the hotel&#39;s central location. 	in the city center and near a metro station , v hotel lavender is in a walkable area with good airport proximity . national museum of singapore and national gallery singapore are cultural highlights , an d some of the area &#39; s activities can be experienced at boat quay and marina bay cruise centre singapore . singapore flyer and national orchid garden are not to be missed . spend some time exploring t he area &#39; s activities , including outlet shopping . our guests appreciate the hotel &#39; s central location .	1
Located in Hulhumalé, Hotel Elite Inn is near the airport and near the beach. Maldives Islamic Centre is a notable landmark, and the area&#39;s natural beauty can be seen at Hulhumale Beach and Kurumba Beach. Looking to get your feet wet? Kayaking, scuba diving and water skiing adventures can be found near the property. 	located in hulhumalé , hotel elite inn is near the airport and near the beach . maldives islamic centre is a notable landmark , and the area &#39; s natural beauty can be seen at hulhumale beach and kurumb a beach . looking to get your feet wet ? kayaking , scuba diving and water skiing adventures can be found near the property .	1
Located in San Jose, Park Inn By Radisson San Jose is in the city center and near the airport. Museum of Costa Rican Art and National Theater are cultural highlights and Spirogyra Butterfly Garden is a popular area attraction. Looking to enjoy an event or a game while in town? See what&#39;s going on at Costa Rica National Stadium (Estadio Nacional de Costa Rica). Be sure not to miss outdoor adventures like mountain biking and horse riding, or hop on a free bike rental nearby and take a self-guided tour around San Jose. Our guests appreciate the hotel&#39;s central location. 	located in san jose , park inn by radisson san jose is in the city center and near the airport . museum of costa rican art and national theater are cultural highlights and spirogyra butterfly garden is a popular area attraction . looking to enjoy an event or a game while in town ? see what &#39; s going on at costa rica national stadium -lrb- estadio nacional de costa rica -rrb- . be sure not to miss outdoor adven tures like mountain biking and horse riding , or hop on a free bike rental nearby and take a self-guided tour around san jose . our guests appreciate the hotel &#39; s central location .	1
Located in St. Julian&#39;s, Hotel Valentina is near the beach. The area&#39;s natural beauty can be seen at St George&#39;s Beach and Upper Barrakka Gardens, while Malta Experience and Fort St. Elmo are cultural highlights. Malta National Aquarium and Mediterraneo Marine Park are also worth visiting. 	located in st. julian &#39; s , hotel valentina is near the beach . the area &#39; s natural beauty can be seen at st george &#39; s beach and upper barrakka gardens , while malta experience and fort st. elmo are cultural highlights . malta national aquarium and mediterraneo marine park are also worth visiting .	1
The Somerset Hotel is located on the waterfront and in an area with great airport proximity. Maldives Islamic Centre and Grand Friday Mosque are notable landmarks, and travelers looking to shop may want to visit Chaandhanee Magu and Male Fish Market. Relax and indulge in the area&#39;s health/beauty spa, or seek out an adventure with ecotours nearby. 	the somerset hotel is located on the waterfront and in an area with great airport proximity . maldives islamic centre and grand friday mosque are notable landmarks , and travelers looking to shop may wa nt to visit chaandhanee magu and male fish market . relax and indulge in the area &#39; s health/beauty spa , or seek out an adventure with ecotours nearby .	1
Croc&#39;s Resort and Casino is located on the beach and in an area with good shopping. Rainforest Adventures Costa Rica Pacific Park and Canopy Vista Los Suenos Adventure Park are worth checking out if an activity is on the agenda, while those wishing to experience the area&#39;s natural beauty can explore Jaco Beach and Herradura Beach. Neo Fauna and Hacienda las Agujas are also worth visiting. Discover the area&#39;s water adventures with scuba diving and water skiing nearby, or enjoy the great outdoors with mountain biking and ziplining. Our guests appreciate the hotel&#39;s central location. 	croc &#39; s resort and casino is located on the beach and in an area with good shopping . rainforest adventures costa rica pacific park and canopy vista los suenos adventure park are worth checking out if an activity is on the agenda , while those wishing to experience the area &#39; s natural beauty can explore jaco beach and herradura beach . neo fauna and hacienda las agujas are also worth visiting . discover the area &#39; s water adventures with scuba diving and water skiing nearby , or enjoy the great outdoors with mountain biking and ziplining . our guests appreciate the hotel &#39; s central locati on .	1
Located in Maafushi, Kaani Village &amp; Spa is in a rural area and near the beach. Local points of interest include Maafushi Mosque, Maafushi Harbor, and Maafushi Reef. Looking to get your feet wet? Kayaking, scuba diving and water skiing adventures can be found near the property. 	located in maafushi , kaani village & spa is in a rural area and near the beach . local points of interest include maafushi mosque , maafushi harbor , and maafushi reef . looking to get your feet wet ? kayaking , scuba diving and water skiing adventures can be found near the property .	1
Located in Ocho Rios, Kaz Kreol Beach Lodge &amp; Wellness Retreat is next to a golf course and on a private beach. The area&#39;s natural beauty can be seen at Mahogany Beach and Turtle River Park, while Mystic Mountain and Dolphin Cove are popular area attractions. Scuba diving offers a great chance to get out on the surrounding water, or you can seek out an adventure with mountain biking, ziplining, and hiking/biking trails nearby. 	located in ocho rios , kaz kreol beach lodge & wellness retreat is next to a golf course and on a private beach . the area &#39; s natural beauty can be seen at mahogany beach and turtle river park , w hile mystic mountain and dolphin cove are popular area attractions . scuba diving offers a great chance to get out on the surrounding water , or you can seek out an adventure with mountain biking , zipli ning , and hiking/biking trails nearby .	1
Located in Cockburn Harbour, Sailrock Resort- Island Hop Flight Included is on the beach. The Boiling Hole is a local attraction and the area&#39;s natural beauty can be seen at Long Beach and Long Cay Beach. With kayaking, scuba diving, and snorkeling nearby, you&#39;ll find plenty of adventures in the water. 	located in cockburn harbour , sailrock resort - island hop flight included is on the beach . the boiling hole is a local attraction and the area &#39; s natural beauty can be seen at long beach and long ca y beach . with kayaking , scuba diving , and snorkeling nearby , you &#39; ll find plenty of adventures in the water .	1
Located in Singapore, Resorts World Sentosa - Beach Villas is near the beach. Singapore Cruise Centre and Marina Bay Cruise Centre Singapore are worth checking out if an activity is on the agenda, while those in the mood for shopping can visit Raffles Place and Bugis Street Shopping District. S.E.A. Aquarium and Universal Studios Singapore™ are not to be missed. 	located in singapore , resorts world sentosa - beach villas is near the beach . singapore cruise centre and marina bay cruise centre singapore are worth checking out if an activity is on the agenda , whi le those in the mood for shopping can visit raffles place and bugis street shopping district . s.e.a. aquarium and universal studios singapore ™ are not to be missed .	1
Located in Singapore, Resorts World Sentosa - Equarius Hotel is near the beach. Madame Tussauds and Chinatown Heritage Center are cultural highlights, and some of the area&#39;s notable landmarks include Merlion and Marina Bay Cruise Centre Singapore. S.E.A. Aquarium and Universal Studios Singapore™ are not to be missed. 	located in singapore , resorts world sentosa - equarius hotel is near the beach . madame tussauds and chinatown heritage center are cultural highlights , and some of the area &#39; s notable landmarks incl ude merlion and marina bay cruise centre singapore . s.e.a. aquarium and universal studios singapore ™ are not to be missed .	1
Located in Singapore, Resorts World Sentosa - Festive Hotel is near the beach. Singapore Cruise Centre and Marina Bay Cruise Centre Singapore are worth checking out if an activity is on the agenda, while those in the mood for shopping can visit Raffles Place and Bugis Street Shopping District. Looking to enjoy an event or a game? See what&#39;s going on at Singapore National Stadium or Singapore Indoor Stadium. Our guests appreciate the hotel&#39;s location for the sightseeing. 	located in singapore , resorts world sentosa - festive hotel is near the beach . singapore cruise centre and marina bay cruise centre singapore are worth checking out if an activity is on the agenda , wh ile those in the mood for shopping can visit raffles place and bugis street shopping district . looking to enjoy an event or a game ? see what &#39; s going on at singapore national stadium or singapore i ndoor stadium . our guests appreciate the hotel &#39; s location for the sightseeing .	1
Located in Singapore, Resorts World Sentosa - Hard Rock Hotel is near the beach. Singapore Cruise Centre and Marina Bay Cruise Centre Singapore are worth checking out if an activity is on the agenda, while those in the mood for shopping can visit Raffles Place and Festive Walk. S.E.A. Aquarium and Universal Studios Singapore™ are not to be missed. 	located in singapore , resorts world sentosa - hard rock hotel is near the beach . singapore cruise centre and marina bay cruise centre singapore are worth checking out if an activity is on the agenda , while those in the mood for shopping can visit raffles place and festive walk . s.e.a. aquarium and universal studios singapore ™ are not to be missed .	1
Located in Singapore, Resorts World Sentosa - Hotel Michael is near the beach. Singapore Cruise Centre and Marina Bay Cruise Centre Singapore are worth checking out if an activity is on the agenda, while those wishing to experience the area&#39;s natural beauty can explore Siloso Beach and Palawan Beach. Check out an event or a game at Singapore National Stadium, and consider making time for S.E.A. Aquarium, a top attraction not to be missed. 	located in singapore , resorts world sentosa - hotel michael is near the beach . singapore cruise centre and marina bay cruise centre singapore are worth checking out if an activity is on the agenda , wh ile those wishing to experience the area &#39; s natural beauty can explore siloso beach and palawan beach . check out an event or a game at singapore national stadium , and consider making time for s.e.a . aquarium , a top attraction not to be missed .	1
Located in Hulhumalé, Royal Relax Holiday is in the city center and on the beach. Maldives Islamic Centre is a notable landmark, and the area&#39;s natural beauty can be seen at Hulhumale Beach and Kurumba Beach. Discover the area&#39;s water adventures with scuba diving, snorkeling, and surfing/boogie boarding nearby, or enjoy the great outdoors with hiking/biking trails. 	located in hulhumalé , royal relax holiday is in the city center and on the beach . maldives islamic centre is a notable landmark , and the area &#39; s natural beauty can be seen at hulhumale beach and ku rumba beach . discover the area &#39; s water adventures with scuba diving , snorkeling , and surfing/boogie boarding nearby , or enjoy the great outdoors with hiking/biking trails .	1
Located in Nassau, Ocean West Boutique Hotel is near the airport and near the beach. Paradise Island Golf Club and Ocean Club Golf Course are worth checking out if an activity is on the agenda, while those wishing to experience the area&#39;s natural beauty can explore Cable Beach and Cabbage Beach. Ardastra Gardens, Zoo and Conservation Center and Stingray City are also worth visiting. Our guests appreciate the hotel&#39;s quiet location. 	located in nassau , ocean west boutique hotel is near the airport and near the beach . paradise island golf club and ocean club golf course are worth checking out if an activity is on the agenda , while those wishing to experience the area &#39; s natural beauty can explore cable beach and cabbage beach . ardastra gardens , zoo and conservation center and stingray city are also worth visiting . our guests appreciate the hotel &#39; s quiet location .	1
