I completely forgot the red onion but this still tasted great. I added a few dashes of red pepper sauce too. Served over rice but husband suggested to serve in fajitas next time. Great flavor.	i completely forgot the red onion but this still tasted great . i added a few dashes of red pepper sauce too . served over rice but husband suggested to serve in fajitas next time . great flavor .	1
This was so good! That even my husband who doesn't even care for chicken loved it. I was looking for a recipe that was for chicken legs when I can across this recipe and I liked the ingredients. I did however change some things to what I had and because I was in a hurry. I used dehydrated onions and garlic and used!/2 teaspoon of cayenne pepper instead of chili powder. I found out my cayenne pepper is really really hot and that is why I used only half the amount. So I can't wait to try this again with chicken breast like it calls for. Thanks for the recipe!	this was so good ! that even my husband who does n't even care for chicken loved it . i was looking for a recipe that was for chicken legs when i can across this recipe and i liked the ingredients . i did however change some things to what i had and because i was in a hurry . i used dehydrated onions and garlic and used ! / 2 teaspoon of cayenne pepper instead of chili powder . i found out my cayenne peppe r is really really hot and that is why i used only half the amount . so i ca n't wait to try this again with chicken breast like it calls for . thanks for the recipe !	1
Excellent. Made this for the first time today and served it as both the meat in tacos for the kids (5&9) and on Mexican salads for the adults. It was a universal hit. We'll try the chipotle pepper idea next time to spice it up a bit.	excellent . made this for the first time today and served it as both the meat in tacos for the kids -lrb- 5 & 9 -rrb- and on mexican salads for the adults . it was a universal hit . we 'll try the chipotle pepper ide a next time to spice it up a bit .	1
Recipe was okay. Make a lot of food but was lacking in flavor..maybe if the sauce was thicker.	recipe was okay . make a lot of food but was lacking in flavor . . maybe if the sauce was thicker .	1
Really good! I omitted the water after a first try because it's a lot easier to reduce the sauce. I like to use Thai chili sauce instead of Jalapenos because I always have it on hand, that way I can really slam it together if I get the urge.	really good ! i omitted the water after a first try because it 's a lot easier to reduce the sauce . i like to use thai chili sauce instead of jalapenos because i always have it on hand , that way i can r eally slam it together if i get the urge .	2
Just made this for dinner tonight.  Delicious!  I wasn't prepared to make it, so had to do some substitutions.  (White onions for green onions, more soy sauce for the fish sauce)  Even with the substitutions, this spicy dish was superb served over brown rice.	just made this for dinner tonight . delicious ! i was n't prepared to make it , so had to do some substitutions . -lrb- white onions for green onions , more soy sauce for the fish sauce -rrb- even with the substi tutions , this spicy dish was superb served over brown rice .	1
WOW this is A-M-A-Z-I-N-G!!!! My thighs were pretty big so I cut my pieces a bit smaller. The flavors here are perfect! This could not have been easier to make but it really seems like you spent some time in the kitchen. Served this over jasmine rice. I will be making this over and over which is not gonna be good for my waistline lol...SOOOO GOOD and definitly worthy of more than 5 stars YUM! Thanks for sharing.:)	wow this is a-m-a-z-i-n-g !!!! my thighs were pretty big so i cut my pieces a bit smaller . the flavors here are perfect ! this could not have been easier to make but it really seems like you spent some time in the kitchen . served this over jasmine rice . i will be making this over and over which is not gon na be good for my waistline lol ... soooo good and definitly worthy of more than 5 stars yum ! than ks for sharing. :-rrb-	1
This recipe was absolutely fantastic! Make sure you watch the video before making it because it's got some crucial things in it.	this recipe was absolutely fantastic ! make sure you watch the video before making it because it 's got some crucial things in it .	1
This was so good. I really can't say enough good things about it. Only made 3 changes I used oyster sauce instead of fish (just what I had) no cilantro no one likes it and no jalapeno (didn't have any)! I will make this again!	this was so good . i really ca n't say enough good things about it . only made 3 changes i used oyster sauce instead of fish -lrb- just what i had -rrb- no cilantro no one likes it and no jalapeno -lrb- did n't have any -rrb- ! i will make this again !	1
4 1/2 Stars- but I'll round up! Seriously one of the best Asian Chicken recipes I've ever made. The chicken was a perfect combination of sweet and spicy, the 1/2 star I took off was because I found the recipe a bit too salty.  I'm sure this will probably vary depending on the brands of soy/fish sauce you use.  I would start light on both then add if needed.  I made half a recipe for my boyfriend and I with a side of sesame green beans and brown rice. I was worried it wouldn't be enough food as I only had 3 chicken thighs, but it was perfect, if not too much food.  I had no troubles with the liquid ratio, but I did have a big pan with not much meat (and a gas stove). I would tend to think that maybe the people who are having trouble may be overcrowding the pan.  All in all this is a wow-worthy recipe, definitely suitable for company. I'll be making this again!	4 1/2 stars - but i 'll round up ! seriously one of the best asian chicken recipes i 've ever made . the chicken was a perfect combination of sweet and spicy , the 1/2 star i took off was because i found th e recipe a bit too salty . i 'm sure this will probably vary depending on the brands of soy/fish sauce you use . i would start light on both then add if needed . i made half a recipe for my boyfriend a nd i with a side of sesame green beans and brown rice . i was worried it would n't be enough food as i only had 3 chicken thighs , but it was perfect , if not too much food . i had no troubles with the li quid ratio , but i did have a big pan with not much meat -lrb- and a gas stove -rrb- . i would tend to think that maybe the people who are having trouble may be overcrowding the pan . all in all this is a wow-wor thy recipe , definitely suitable for company . i 'll be making this again !	1
(I thought) I followed the recipe exactly and it took an hour for the sauce to reduce! We eventually ate and everyone loved it (or maybe everyone was just starving). I will try it again and omit the water. I cooked it in a wok...maybe that was my problem /:	-lrb- i thought -rrb- i followed the recipe exactly and it took an hour for the sauce to reduce ! we eventually ate and everyone loved it -lrb- or maybe everyone was just starving -rrb- . i will try it again and omit the w ater . i cooked it in a wok ... maybe that was my problem / :	1
I am ONLY reviewing the sauce because I went in a different direction with my chicken. I used rotisserie chicken thighs and French cut green beans and almonds. I made the sauce exactly as written and just reduced it down, then added my chicken, green beans and almonds to heat through. Served over brown Jasmine rice with egg rolls on the side. The sauce is *wonderful* and would be good on just about any Asian-inspired sauce you chose to use it in. I will definitely make this again, maybe even as written sometime! But I dunno, my version is going to be hard to beat. :-)	i am only reviewing the sauce because i went in a different direction with my chicken . i used rotisserie chicken thighs and french cut green beans and almonds . i made the sauce exactly as written and just reduced it down , then added my chicken , green beans and almonds to heat through . served over brown jasmine rice with egg rolls on the side . the sauce is * wonderful * and would be good on just abou t any asian-inspired sauce you chose to use it in . i will definitely make this again , maybe even as written sometime ! but i du n no , my version is going to be hard to beat . :--rrb-	1
This dish is perfection. I've made it twice already.	this dish is perfection . i 've made it twice already .	1
This is amazing. I used regular radishes because they were in the fridge and red wine vinegar in place of sherry vinegar. Served it with Chef John's Brussels sprouts and they were a perfect complement. Totally restaurant quality!	this is amazing . i used regular radishes because they were in the fridge and red wine vinegar in place of sherry vinegar . served it with chef john 's brussels sprouts and they were a perfect complement . totally restaurant quality !	1
I would give this a 10! I followed this recipe to the letter and my family didn't leave a schmekle! Thank you!!	i would give this a 10 ! i followed this recipe to the letter and my family did n't leave a schmekle ! thank you !!	1
Was very tender but REALLY rich and fat. I would almost freeze the sauce to get rid of more fat. First time I enjoyed radishes!	was very tender but really rich and fat . i would almost freeze the sauce to get rid of more fat . first time i enjoyed radishes !	1
Sauce was the richest ever and the parsnips were wonderful. My butcher didn't have the required cut so I used some other cut and it was clearly far too lean. So try to get the right kind of cut with lots of fat inside the meat.	sauce was the richest ever and the parsnips were wonderful . my butcher did n't have the required cut so i used some other cut and it was clearly far too lean . so try to get the right kind of cut with l ots of fat inside the meat .	1
This meal is freightenly good! I mean seriously it's scary. Hands down the best dish I've ever had. Also I used reg. radishes cuz they didn't have the breakfast ones and they tasted great and looked the same as the video.	this meal is freightenly good ! i mean seriously it 's scary . hands down the best dish i 've ever had . also i used reg . radishes cuz they did n't have the breakfast ones and they tasted great and looked t he same as the video .	1
This was as fabulous as everyone said it would be - I ll definitely make it again! The only change and I think someone else mentioned this was the amount of fat that came off the lamb chops. This will depend on which chops you use but spooning the fat off didn t help. I ll use my gravy separater to get most of the fat off. Considering that you add butter at the end I don t think it will ruin the mouth feel of the sauce.	this was as fabulous as everyone said it would be - i ll definitely make it again ! the only change and i think someone else mentioned this was the amount of fat that came off the lamb chops . this will depend on which chops you use but spooning the fat off didn t help . i ll use my gravy separater to get most of the fat off . considering that you add butter at the end i don t think it will ruin the m outh feel of the sauce .	1
"I had friends over to help rake leaves today so I made them lunch.  I made the A La King this morning and just reheated at lunch time.  I served it over beds of brown rice (also re-heated) and a crisp salad.  HUGE likes! 
Everyone liked it very much.  I made the recipe exactly as written.  The next time I make it I will throw in another shallot and a clove or two of garlic.  Only because I would prefer it, not because the recipe needs it.  Another Great Chef John recipe!"	i had friends over to help rake leaves today so i made them lunch . i made the a la king this morning and just reheated at lunch time . i served it over beds of brown rice -lrb- also re-heated -rrb- and a crisp salad . huge likes ! everyone liked it very much . i made the recipe exactly as written . the next time i make it i will throw in another shallot and a clove or two of garlic . only because i would p refer it , not because the recipe needs it . another great chef john recipe !	1
This was hit when served for Sunday dinner. My Daughter In-law called this next day for the recipe. The only change I made was added frozen peas because my wife said that was how her mother made it. The peas worked well and the flavor was great.	this was hit when served for sunday dinner . my daughter in-law called this next day for the recipe . the only change i made was added frozen peas because my wife said that was how her mother made it . t he peas worked well and the flavor was great .	1
I classic and great comfort food. Loved this recipe although my husband would have preferred fewer mushrooms.	i classic and great comfort food . loved this recipe although my husband would have preferred fewer mushrooms .	1
Made as directed used a rotisserie chicken I picked up at the grocery store. Served over egg noodles. Flavors molded together very nicely. Agree with not leaving out the sherry. Presents very pretty with it's autumn colors. Could easily take the place of a turkey for Thanksgiving!	made as directed used a rotisserie chicken i picked up at the grocery store . served over egg noodles . flavors molded together very nicely . agree with not leaving out the sherry . presents very pretty w ith it 's autumn colors . could easily take the place of a turkey for thanksgiving !	1
Ok so I grew up on Banquet frozen chicken a la king and my husband grew up on his dad's version of turkey a la king. I was hoping that 1) this would be close to what we grew up on and 2) that it would be phenomenal due to it being one of Chef John's recipes but after all the work to make it (no modifications other than used gluten free AP flour) and the resulting flavor I am disappointed. My husband said he would not want me to make it again and really I don't have any desire to. I served it over GF biscuits (figured toasted bread like in childhood was too plain for a meal that took this long to make). I really don't know what would make it be five stars. I guess I'll keep looking.	ok so i grew up on banquet frozen chicken a la king and my husband grew up on his dad 's version of turkey a la king . i was hoping that 1 -rrb- this would be close to what we grew up on and 2 -rrb- that it would be phenomenal due to it being one of chef john 's recipes but after all the work to make it -lrb- no modifications other than used gluten free ap flour -rrb- and the resulting flavor i am disappointed . my husba nd said he would not want me to make it again and really i do n't have any desire to . i served it over gf biscuits -lrb- figured toasted bread like in childhood was too plain for a meal that took this long to make -rrb- . i really do n't know what would make it be five stars . i guess i 'll keep looking .	1
I followed the recipe exactly as written. A very tasty, filling meal. Chef John is the best when you need to find something that you can make without modification that is a successful dish every time.	i followed the recipe exactly as written . a very tasty , filling meal . chef john is the best when you need to find something that you can make without modification that is a successful dish every time .	1
Super comfort food on mashed potatoes.	super comfort food on mashed potatoes .	1
This is definitely a keeper. We like it for breakfast or lunch on popovers.	this is definitely a keeper . we like it for breakfast or lunch on popovers .	1
I love Chef John recipes! This one was excellent. I did add some carrots and green beans and about 4 oz. of cream cheese as well. I put it over Cauliflower rice.	i love chef john recipes ! this one was excellent . i did add some carrots and green beans and about 4 oz . of cream cheese as well . i put it over cauliflower rice .	1
I really liked this but I wanted to make it more substantial so I added some broccoli. I cooked the bacon then removed it from the pan. Then I cooked the broccoli in the bacon fat salt pepper and garlic. Then I threw in the beans and greens turned off the heat stirred for about 2mins added the lemon juice and stirred again. I served the bacon on top to keep it crispy. Definitely do not skip the lemon it adds a nice bright flavor!	i really liked this but i wanted to make it more substantial so i added some broccoli . i cooked the bacon then removed it from the pan . then i cooked the broccoli in the bacon fat salt pepper and garl ic . then i threw in the beans and greens turned off the heat stirred for about 2 mins added the lemon juice and stirred again . i served the bacon on top to keep it crispy . definitely do not skip the le mon it adds a nice bright flavor !	1
I didn't change a thing in the recipe however I did make it way to soon and had to reheat and because of that it wasn't as pretty but it was still fantastic! I will make these again and again!	i did n't change a thing in the recipe however i did make it way to soon and had to reheat and because of that it was n't as pretty but it was still fantastic ! i will make these again and again !	1
So fast and delicious! I actually forgot to sprinkle the lemon juice on at the end and it was still amazing. I'll remember next time. I added a shake of Parmesan cheese. Family loved it!	so fast and delicious ! i actually forgot to sprinkle the lemon juice on at the end and it was still amazing . i 'll remember next time . i added a shake of parmesan cheese . family loved it !	1
These beans are so good! I couldn't find any arugula at my grocery store so I substituted baby spinach. Other than that I didn't change a thing. Fast easy delicious.	these beans are so good ! i could n't find any arugula at my grocery store so i substituted baby spinach . other than that i did n't change a thing . fast easy delicious .	1
Way too much lemon for my liking. It's a great recipe otherwise and I will make it again. Thank you.	way too much lemon for my liking . it 's a great recipe otherwise and i will make it again . thank you .	1
This recipe is wonderful! It makes for a quick work day lunch as well. Didn't change a thing.	this recipe is wonderful ! it makes for a quick work day lunch as well . did n't change a thing .	1
As I faithfully followed the recipe my beans disintegrated leaving an almost hummus like paste. I don't know if my canned beans were over-cooked (at the bean factory) or if medium heat on my cooktop is calibrated differently than Chef John's. The flavors were interesting but not so spectacular that I'll spend time trying to figure things out. Thanks anyway Chef John. You are still my favorite.	as i faithfully followed the recipe my beans disintegrated leaving an almost hummus like paste . i do n't know if my canned beans were over-cooked -lrb- at the bean factory -rrb- or if medium heat on my cooktop i s calibrated differently than chef john 's . the flavors were interesting but not so spectacular that i 'll spend time trying to figure things out . thanks anyway chef john . you are still my favorite .	1
This was perfect for the cool autumn day. Great taste very quick and easy to make. I will make this again but I will use more arugula perhaps as much as twice the recipe.	this was perfect for the cool autumn day . great taste very quick and easy to make . i will make this again but i will use more arugula perhaps as much as twice the recipe .	1
Really nice hash style recipe. Only thing I added was some spicy seasoning at the end. Do toast the hazlenuts.. there is a huge difference in thair flavor. Taste some untoasted and then toast some up... so much better toasted	really nice hash style recipe . only thing i added was some spicy seasoning at the end . do toast the hazlenuts . . there is a huge difference in thair flavor . taste some untoasted and then toast some up . . . so much better toasted	1
I changed a few things... use apples instead of pears as that was all I had, used Jack Daniels instead of Irish Whiskey, walnuts instead of hazelnuts and used chicken boullion instead of just water. I also tripled the whiskey amount, as my husband and I both love the taste of whiskey and the dish was not overpoweringly whiskey tasting. It was perfect! Absolutely will make again, especially in the fall.	i changed a few things ... use apples instead of pears as that was all i had , used jack daniels instead of irish whiskey , walnuts instead of hazelnuts and used chicken boullion instead of just water . i also tripled the whiskey amount , as my husband and i both love the taste of whiskey and the dish was not overpoweringly whiskey tasting . it was perfect ! absolutely will make again , especially in the fall .	1
"Made this tonight on a whim to use some sweet potatoes I had. I used some drumsticks instead just because I had them and it was great. 

 It was delicious! I would however make a few adjustments next time. I loved the pears and would add another. I would also double the spinach, since it cooks down so much. 

Other than that - fab!"	made this tonight on a whim to use some sweet potatoes i had . i used some drumsticks instead just because i had them and it was great . it was delicious ! i would however make a few adjustments next time . i loved the pears and would add another . i would also double the spinach , since it cooks down so much . other than that - fab !	1
I hate when people rate recipes after they've altered it, but I'm sure the original is just as good, if not better, than the version I made.  Based on what I had on hand, I used granny smith apples instead of pears, omitted the whiskey, and used toasted almonds instead of hazelnuts.  It was delicious!  Next time I will make it as written to see which version is better, but I'll leave the chicken out because I don't think it adds anything.	i hate when people rate recipes after they 've altered it , but i 'm sure the original is just as good , if not better , than the version i made . based on what i had on hand , i used granny smith apples in stead of pears , omitted the whiskey , and used toasted almonds instead of hazelnuts . it was delicious ! next time i will make it as written to see which version is better , but i 'll leave the chicken o ut because i do n't think it adds anything .	1
I didn't have spinach so added leeks and mushrooms instead. Very tasty! The pear and sage make a lovely difference	i did n't have spinach so added leeks and mushrooms instead . very tasty ! the pear and sage make a lovely difference	1
I doubled the recipe and used leftover cooked chicken. I even made sure to buy hazelnuts for this and toasted them which was very easy to do. This recipe was delicious and a good way of getting a lot of healthy items into my hubbys diet in one dish. Spinach cooked down so much that even more could be added without overpowering the taste of this lovely hash.	i doubled the recipe and used leftover cooked chicken . i even made sure to buy hazelnuts for this and toasted them which was very easy to do . this recipe was delicious and a good way of getting a lot of healthy items into my hubbys diet in one dish . spinach cooked down so much that even more could be added without overpowering the taste of this lovely hash .	1
Good flavors but I felt like it was missing some depth. I'll add more whiskey next time and maybe chicken stock instead of water. Wait on adding the pears until just before serving or they start to break down.	good flavors but i felt like it was missing some depth . i 'll add more whiskey next time and maybe chicken stock instead of water . wait on adding the pears until just before serving or they start to br eak down .	1
Tastes like a hash with sweet potatoes rather mushy and spinachy... Don't like sweet potato and spinach combo....just my opinion. Nobody here ate it except the insinkerator....	tastes like a hash with sweet potatoes rather mushy and spinachy ... do n't like sweet potato and spinach combo ... just my opinion . nobody here ate it except the insinkerator ...	1
"Since writing this recipe I have changed to a skillet.  Brown chicken breasts on both sides in olive oil.  Squeeze 1/2 of a lemon over all.  Cover with lid over medium heat.  Cook til done.
Turning a few more times.  If you want it more lemony add a teaspoon of lemon zest.
I have also added 1 more cup of mushrooms to the sauce.   Thanks for the reviews."	since writing this recipe i have changed to a skillet . brown chicken breasts on both sides in olive oil . squeeze 1/2 of a lemon over all . cover with lid over medium heat . cook til done . turning a few more times . if you want it more lemony add a teaspoon of lemon zest . i have also added 1 more cup of mushrooms to the sauce . thanks for the reviews .	2
